question,answer,A,B,C,D
Iago is the antagonist of which play by William Shakespeare?,Othello,,,,
One of Johnny Depps earliest film roles was as Gator Lerner in what 1986 movie?,Platoon,The Color of Money,Platoon,Top Gun,Aliens
"Which of these Tim Burton films, starring Johnny Depp, came first?",Edward Scissorhands,Charlie and the Chocolate Factory,Ed Wood,Sleepy Hollow,Edward Scissorhands
"This Scottish author, portrayed by Johnny Depp in the movie Finding Neverland, created the fictional character Peter Pan.",James Barrie,John Dunne,George Eliot,Joseph Grimm,James Barrie
"In the 2001 movie Blow, Johny Depps role is based on the real life story of his character.",True,True,False,,
What is the first name of Johnny Depps character in the 2004 film Secret Window?,Mort,Tom,Alan,Lou,Mort
Johnny Depp played the role of Inspector Fred Abberline in what 2001 film?,From Hell,From Hell,Nick of Time,Chocolat,The Astronauts Wife
"Johnny Depp publicly stated that he, in part, had based his portrayal of Captain Jack Sparrow in Pirates of the Caribbean: The Curse of the Black Pearl on which musician?",Keith Richards,Jim Morrison,Ozzy Osbourne,Mick Jagger,Keith Richards
"In the 1993 movie Whats Eating Gilbert Grape, Gilbert Grape is the name of the character played by Johnny Depp.",True,False,True,,
When was Elvis born?,"January 8, 1935","January 8, 1935","January 8, 1977","August 16, 1935","August 8, 1977"
Who were Elviss parents?,Gladys and Vernon,Billy and Joseph,Gladys and Vernon,Lisa Marie and Vernon,Priscilla and Dee
What is Elviss mansion called?,Graceland,Neverland,Swampland,Kingstown,Graceland
What town was Elvis born in?,Tupelo,Branson,Memphis,Tupelo,Nashville
He played Nicholas Bradford on the ultra popular 70s sitcom Eight is Enough.,Adam Rich,Adam Rich,Jason Bateman,Meeno Peluce,Danny Pintauro
Rapper turned actor Will Smith married this actress in 1997.,Jada Pinkett,Brandy Norwood,Nia Long,Jada Pinkett,Shia LeBeouf
Former tennis great Steffi Graf married this former tennis great in 2001.,Andre Agassi,John McEnroe,Boris Becker,Andre Agassi,Jimmy Connors
"In 1997, Actor Matthew Broderick married this Sex and the City star.",Sarah Jessica Parker,Kristen Davis,Sarah Jessica Parker,Cynthia Nixon,Kim Catrall
What famous actor did Catherine Zeta Jones marry in 2000?,Michael Douglas,Kirk Douglas,Michael Douglas,Jeff Bridges,Lloyd Bridges
Actor James Brolin married this famous singer in 1998.,Barbra Streisand,Aretha Franklin,Barbra Streisand,Bette Midler,Maria Muldaur
Singer Jennifer Lopez married this famous singer in 2004.,Mark Anthony,Dave Grohl,Enrique Iglesias,Gavin Rossdale,Mark Anthony
Actor Ben Stiller married this actress in 2000.,Christine Taylor,Pam Anderson,Nikki Taylor,Christine Taylor,Heather Graham
"In 2002, pop diva Gwen Stefani married the former lead singer of the band Bush. What is the name of Stefanis significant other?",Gavin Rossdale,Ross Gavindale,Nigel Pulsford,Gavin Rossdale,Chris Traynor
What actor did Demi Moore marry in 2005?,Ashton Kutcher,Ashton Kutcher,Bruce Willis,Brendan Fraser,Patrick Dempsey
"In 2005, actress Jennifer Garner married this Hollywood movie star.",Ben Affleck,Matt Houston,Matt Damon,Ben Affleck,John Stamos
"This actor made his film debut in Rubberface and followed it with appearances in Copper Mountain, Once Bitten and Peggy Sue Got Married before he hit the big time.",Jim Carrey,Dean Cain,Jim Carrey,Matt Dillon,Alan Cumming
This American actor played the roles of Mr. Big in the 007 film Live and Let Die and Parker in the hit Sci-Fi movie Alien.  He later starred in the TV show Homicide: Life on the Street.,Yaphet Kotto,Yaphet Kotto,Nicholas Downs,Dana Carvey,George Chakiris
This British actor is the eldest of a pair of twins and who played George Weasley in the Harry Potter series of films.,Oliver Phelps,Yaphet Kotto,Sean Astin,Samuel Sarpong,Oliver Phelps
This American actor was one of the child stars of The Goonies and also played a brave and helpful hobbit in Lord Of The Rings.,Sean Astin,Orlando Bloom,Garrett Hedlund,Sean Astin,Norman Reedus
"This American actor has received two Academy Award nominations for Best Actor in a Leading Role, winning it once for his portrayal of a suicidal alcoholic in Leaving Las Vegas.",Nicholas Cage,Steve Buscemi,Nicholas Cage,Macaulay Culkin,Danny Glover
"This British actor came to fame playing a drug addict in Trainspotting and has appeared in a variety of independent and blockbuster movies, including the recent Star Wars films.",Ewan McGregor,Ian McKellen,Ryan Reynolds,Norman Wisdom,Ewan McGregor
"This American is an actor, producer, director and general philanthropist.  He is responsible for setting up the Sundance Independent Film Festival.",Robert Redford,Stephen Dorff,Matthew Broderick,Nick Nolte,Robert Redford
"This British actor is mainly known for his portrayal of a schoolboy wizard, but has also appeared on stage naked!",Daniel Radcliffe,Frank Converse,Kenneth Branagh,Ewan McGregor,Daniel Radcliffe
"This versatile young actor has played a diverse range of characters in films, but is known best as a heroic little hobbit in Peter Jacksons blockbuster trilogy of Lord Of The Rings.",Elijah Wood,Haley Joel Osment,Elijah Wood,Ryan Reynolds,Edward Speleers
This British actor is probably best known for playing the villain Blofeld in the James Bond series of films and Dr. Loomis in the Halloween movies.,Donald Pleasence,Stuart Townsend,Samuel West,Donald Pleasence,Tom Baker
"Which actor, who played Legolas in The Lord of the Rings trilogy, was born on January 13, 1977?",Orlando Bloom,Elijah Wood,Sean Astin,Orlando Bloom,Viggo Mortensen
"What more than 10-time Grammy Award winning pop singer was born on February 2, 1977.",Shakira,Nelly Furtado,Pink,Mya,Shakira
"This actress, who starred in the movie I Know What You Did Last Summer, was born on April 14, 1977. What is her name?",Sarah Michelle Gellar,Rachael Leigh Cook,Jennifer Love Hewitt,Sarah Michelle Gellar,Brandy
"Which singer, born on January 28, 1977, was a member of the popular boy-band N Sync?",Joey Fatone,Joey Fatone,Lance Bass,Nick Carter,Justin Timberlake
"This actor, who is also an animal rights activist, was born on August 2, 1977. He was arrested in Kentucky for attempting to free lobsters from a grocery store.",Edward Furlong,Chris Klein,Macaulay Culkin,Edward Norton,Edward Furlong
What instrument did Louis Armstrong play?,Trumpet,Saxophone,Trumpet,Clarinet,Violin
What instrument did jazz musician Benny Goodman play?,Clarinet,Drums,Flute,Clarinet,Saxophone
Prince can play the drums.,True,False,True,,
"Matt Cameron, who has been a member of Soundgarden and Pearl Jam, plays what instrument?",Drums,Keyboards,Drums,Bass,Guitar
Bobby Militello of The Dave Brubeck Quartet plays the piano.,False,False,True,,
"Adam Yauch, one of the founding members of the Beastie Boys, plays which of the following instruments?",Bass,Turntable,Bass,Keyboards,Guitar
Buddy Guy played a Fender Stratocaster.,True,True,False,,
"David Bowie plays many instruments, which of the below does he also play?",Cello,French Horn,Cello,Flute,Bass
Nick Rhodes from Duran Duran plays what instrument?,Keyboards,Keyboards,Tuba,Symbols,Drums
What is the middle name of John Stamos?,Phillip,Jesse,Ronald,Roy,Phillip
Actor John Stamos didnt play in which one of these shows?,Different Strokes,Full House,General Hospital,Different Strokes,ER
John Stamos original family name was Stamotopoulos.,True,False,True,,
"John Stamos dated singer and American Idol judge, Paula Abdul.",Yes,No,Yes,,
Was John Stamos cast in the role of the main character Jake in Jake in Progress?,Yes,Yes,No,,
The TV sitcom Fullhouse ran on ABC for how many seasons?,8,1,6,8,11
"John Stamos was born in Cypress, California on what date?","August, 19","August, 2","August, 19","July, 11","August, 12"
Did Rebecca Romijn and John Stamos divorce in 2005?,Yes,Yes,No,,
John Stamos appeared in an episode of Friends.,True,True,False,,
"The song A Day in the Life, from the Beatles Sgt. Peppers album, contains a Paul McCartney death clue that supposedly reveals what?",The manner of Pauls death,Pauls age when he died,Who took Pauls place in the band,The manner of Pauls death,Why Pauls death was kept a secret
"Who took Paul McCartneys place in the Beatles, according to a death clue in the song Sgt. Peppers Lonely Hearts Club Band on the album of the same name?",Billy Shears,Mr. Kite,Sgt. Pepper,Billy Shears,An unnamed replacement
"The Paul is dead myth holds that Paul McCartney died on November 9, 1966.  Which of the following is not a clue suggesting that date?",The Beatles had released nine albums by the time Paul supposedly died.,"The bass drum on the Sgt. Peppers album cover has a hidden message, visible by holding a mirror through the middle of the drum, indicating 11/9.","The lyrics of Shes Leaving Home include the line, Wednesday morning at five oclock, and November 9, 1966, was a Wednesday.",The repetition of number nine in the song Revolution 9 means November nine.,The Beatles had released nine albums by the time Paul supposedly died.
"Richard Kiel, who is 72 tall, remains best known for which role in the James Bond movies?",Jaws,Jaws,Mr. Kidd,Largo,Mister Big
Sean Connery was placed third in the tall mans division of 1953 Mr. Universe Bodybuilding Contest.,True,True,False,,
"Which of the following James Bond movies, starring Sean Connery, was released first?",Dr. No,Thunderball,Never Say Never Again,From Russia with Love,Dr. No
What of these was the last movie Sean Connery made?,The League of Extraordinary Gentlemen,Finding Forrester,The League of Extraordinary Gentlemen,First Knight,The Avengers
Sean Connery was offered a role in The Matrix but turned it down.,True,True,False,,
Sean Connery has done voice-over work in a video game.,True,True,False,,
Sean Connery got tattoos while he was in the Navy.,True,False,True,,
Why was Sean Connerys service in the Navy shortened?,stomach ulcer,Bad conduct,none of the above,injury to his back,stomach ulcer
"This actor gave his voice to the popular animated cartoon cat Garfield. He was also known as the voice of Carlton, the doorman on the television comedy Rhoda, a spin-off of the Mary Tyler More Show.",Lorenzo Music,Lorenzo Music,Billy Gilbert,Ernie Sabella,Peter Falk
"An elephant in Dumbo, the Queen of Hearts in Alice in Wonderland, and Flora in Sleeping Beauty were some of the best roles of this voice actress.",Verna Felton,Edith Head,Nancy Cartwright,Lucille La Verne,Verna Felton
"You remember this actress voice from Mulan (Grandmother Fa), Cinderella (Lucifer the Cat) and The Smurfs (Jokey Smurf and Mother Nature). She was also Granny, the owner of Tweety and Sylvester the cat.",June Foray,Adriana Caselotti,Mary K. Bergman,Shaaron Claridge,June Foray
"Which of these characters was voiced by Adriana Caselotti, an Italian-American actress of a musical family?",Snow White,Roger Rabbit,Snow White,The Little Mermaid,Cinderella
"This TV and voice actor is from a Jewish family from Greece. He has had many voice roles (numerous characters on the The Simpsons, Eddie Brock in the Spider-Man animated series), several Emmys, and roles in many movies and TV shows.",Hank Azaria,Mike Judge,Johnny Knoxville,Hank Azaria,Paul Giamotti
"To which of these animated films has popular American actress and voice artist, Mae Questel not contributed?",Micky Mouse,Who Framed Roger Rabbit,Popeye the Sailor,Micky Mouse,Betty Boop
"This remarkable ventriloquist voiced Scooby-Doo, Papa Smurf, Astro (the Jetsons dog), Hampton Pig, Boo-Boo (Yogi Bears buddy) and Ruff from Ruff n Reddy.",Don Messick,Don Messick,Thurl Ravenscroft,Trey Parker,Hans Conreid
"This voice actor was often called the king of the movie trailer, having voiced the trailers for over 3,000 movies. He is given credit for such movie clichÃ©s as A one man army.... and In a world, where....",Don La Fontaine,Isaac Hayes,Peter Cullen,Don La Fontaine,Melvin Franklin
"This actor from Paterson, New Jersey voiced Joe Swanson in Family Guy, Kronk in The Emperors New Groove, and Tick in TV series, Tick.",Patrick Warburton,Mike Judge,Daws Butler,Tex Brasher,Patrick Warburton
"Bill Scott, a voice actor, writer, and producer of animated cartoons, primarily in association with Jay Ward, was the voice of three of these characters. Name the one he did not voice.",Boris Badenough,Boris Badenough,Bullwinkle,Mr. Big,George of the Jungle
"This American actress, born in Paris, is best known for voicing Lisa Simpson from The Simpsons series. She also appeared on the situation comedies Hermans Head and Dharma and Greg.",Yeardley Smith,Julie Kravner,Yeardley Smith,Nancy Cartwright,Daniella Castellaneta
Her name is Memphis Eve. Who is her famous dad?,Bono,Bono,Todd Rundgren,Shaquille ONeal,Gregg Allman
"He changed his family name to separate himself from his famous uncle, but he named his son Kal-El.",Nicholas Cage,Jack Black,Nicholas Cage,Elliot DePalma,John Soderburgh
"She has named her children Six, Seven, Fly and Puma.",Erykah Badu,Erykah Badu,Shakira,Mel B.,Mel C.
"This Hawaiian born actress/singer starred in A Knights Tale; Kiss, Kiss, Bang, Bang; and appeared as a guest star on several TV shows. She named her son Audio Science Clayton.",Shannon Sossamon,Edie Falco,Shannon Sossamon,Keira Knightly,Bette Midler
Singer Sarah McLachlan has children named India Ann Sushil and Tajah Summer.,True,False,True,,
"This actor and friend of Jimmy Stewart served on board the U.S.S. destroyer, Satterlee. He served honorably in war, yet his daughter spent most of her early life protesting the Vietnam War.",Henry Fonda,Robert Mitchum,Kirk Douglas,John Wayne,Henry Fonda
"It was clear...frankly my dear, he did give a damn. He served honorably in WWII in the air force.",Clark Gable,Spencer Tracy,Clark Gable,Douglas Fairbanks,Lee Marvin
Nicolas Cage played one of the protagonists in the movie Fast Times at Ridgemont High.,False,True,False,,
In which of these movies has Nicolas Cage not appeared?,Crash (2004),Face Off,Crash (2004),Con Air,The Family Man
What was the occupation of Nicolas Cages character in the movie It Could Happen to You?,a police officer,a painter,a lawyer,a judge,a police officer
In which of these movies does Nicolas Cage play an arms dealer?,Lord of War,Warlord,The Warlords,Lord of War,War
Which of these war movies stars Nicolas Cage?,Windtalkers,Black Hawk Down,Saving Private Ryan,Windtalkers,Thin Red Line
Does Willem Dafoe star with Nicolas Cage in the 1990 movie Wild at Heart?,Yes,Yes,No,,
Nicolas Cage plays Andrew Sterling in the movie Amos  Andrew.,False,False,True,,
What was the name of Nicolas Cages character in the movie City of Angels?,Seth,Steven,Nate,Nathaniel,Seth
Nicolas Cage won an Academy Award for his performance as a suicidal alcoholic in this movie.,Leaving Las Vegas,Wild at Heart,8mm,Leaving Las Vegas,Adaptation
"The movie Captain Corellis Mandolin, starring Nicolas Cage, is set during which war?",WWII,The Vietnam War,None of these,WWII,WWI
"What was the full name of Hardy, of the famous comedy partnership, Laurel and Hardy?",Oliver Norwell Hardy,Oliver Norwell Hardy,Oliver Wendell Hardy,Wendell Oliver Hardy,Norton Oliver Hardy
"What was the full name of Laurel, of the famous comedy duo, Laurel and Hardy?",Arthur Stanley Jefferson,Stanley Arthur Jefferson,Wolliam Wendell Laurel,Arthur Stanley Jefferson,Arthur Stanley Laurel
"Which was the first movie in which Stan Laurel and Oliver Hardy both appeared in 1921, albeit not as a team?",A Lucky Dog,A Lucky Dog,The Second Hundred Years,The Bohemians,The  Piano Movers
"What was the last movie famous comedy duo, Laurel and Hardy made together?",Atoll K (aka Utopia),The Bohemians,Atoll K (aka Utopia),The Jerks at Sea,The Kentucky Gentlemen
"Which of these is not a name comedy duo Laurel and Hardy went by, in European countries?",Da Schoene und da Huebsche,Dick und Dorf,Da Schoene und da Huebsche,El Gordo y El Flaco,Stallio and Ollio
Which of the two members of comedy team Laurel and Hardy won a Lifetime Achievement Academy Award from the Screen Actors Guild ?,Laurel,Neither,Laurel,They won as a team,Hardy
"What was the cause of American actor, Oliver Hardys death on August 7, 1957?",Stroke,Stroke,Tuberculosis,Cancer,Heart attack
"Which of comedy team, Laurel and Hardys films won an Oscar for Best Comedy Short Subject in 1932?",The Music Box,The Music Box,The Tie Twiddler,The Bohemian Girl,Two Jerks at Sea
Which was the first movie in which actors Stan Laurel and Oliver Hardy officially appeared as a team?,The Second Hundred Years (June 1927),The Second Hundred Years (June 1927),Babes in Toyland (1934),The Lucky Dog (1921),The Music Box (1932)
Who co-starred with Elvis in Flaming Star?,Barbara Eden,Debra Paget,Juliet Prowse,Shelly Fabares,Barbara Eden
Which actress was Elviss love interest in Blue Hawaii?,Joan Blackman,Joan Blackman,Judy Tyler,Debra Paget,Carolyn Jones
Loving You stars Elvis Presley and this actress.,Dolores Hart,Diana Goodwin,Judy Tyler,Barbara Eden,Dolores Hart
"Elviss first film, Love Me Tender, stars what leading lady?",Debra Paget,Dolores Hart,Judy Tyler,Dianna Goodwin,Debra Paget
Elviss girlfriend in Charro was played by this actress.,Ina Balin,Carolyn Jones,Ina Balin,Barbara Eden,Dolores Hart
Stay Away Joe was a completely different image for Elvis.  Who starred with him in this film?,Katy Jurado,Ann-Margret,Katy Jurado,Carolyn Jones,Shelly Fabares
"Of all the movie stars Elvis Presley worked with, she was the only one to attend his funeral.",Ann-Margret,Juliet Prowse,Ann-Margret,Stella Stevens,Shelly Fabares
"Who did Elvis dance the Flamenco with, in movie Girls, Girls, Girls?",Laura Goodwin,Laura Goodwin,Donna Douglas,Stella Stevens,Juliet Prowse
"What actress starts in Live A Little Love A Little,  alongside Elvis?",Michele Cary,Nancy Sinatra,Connie Stevens,Michele Cary,Debra Paget
"There is more than one lady after Elviss attention in the move Fun In Acapulco, but only this one can be his Bosa Nova Baby.",Elsa Cardenas,Elsa Cardenas,Ann-Margret,Joan Blackman,Ursula Andress
It Happened at the Worlds Fair (1963) stars Elvis and this beauty.,Joan OBrien,Elsa Cardenas,Ursula Andress,Joan OBrien,Ann-Margret
"In the film,Wild in the Country, Elvis had to choose between three of these four leading ladies. Which actress did he pick?",Tuesday Weld,Tuesday Weld,Millie Perkins,Hope Lange,Laura Goodwin
Which R  B songstress named her child Puma?,Erykah Badu,Toni Braxton,Erykah Badu,Lauryn Hill,Mary J. Blige
Diezel is the child of which R  B songstress?,Toni Braxton,Vanessa Williams,Toni Braxton,Brandy,Lauryn Hill
Kal-el is the child of which Oscar winning actor?,Nicholas Cage,Dustin Hoffman,Nicholas Cage,Russell Crowe,Tom Hanks
This Oscar winning actress named her daughter Apple.,Gwyneth Paltrow,Helen Hunt,Frances McDormand,Gwyneth Paltrow,Hilary Swank
This former supermodel named her child Sailor Lee.,Christie Brinkley,Kathy Ireland,Rachel Hunter,Cheryl Tiegs,Christie Brinkley
Which television and movie actor has a child named Thyme?,Isiah Washington,Patrick Dempsey,Kevin Bacon,Bruce Willis,Isiah Washington
This movie star named his child Reignbeau.,Ving Rhames,Damon Wayans,Jamie Foxx,Ving Rhames,Samuel L. Jackson
Which Australian born actress named her child Banjo?,Rachel Griffiths,Rachel Griffiths,Toni Collette,Naomi Watts,Nicole Kidman
Which comedian has a child named Moxie Crimefighter?,Penn Jillette,Adam Carolla,Penn Jillette,Jason Alexander,Chris Kattan
Which musician has a son named Speck Wildhorse?,John Mellancamp,Jon Bon Jovi,John Denver,John Mellancamp,Bono
"Which Aerosmith song are the following lyrics from: Sing with me, sing for the year, sing for the laughter, sing for tear..?",Dream On,Walk This Way,I Dont Want To Miss A Thing,Dream On,Rag Doll
"Which is the missing word from the lyrics of the popular Aerosmith song I Dont Want To Miss A Thing: âI could stay awake, just to hear you _________â?",Breathing,Sleeping,Blinking,Walking,Breathing
"The following lyrics are from the song Walk On Water by Aerosmith: âCruised into a bar on the, her picture graced the grime on the door.â",False,True,False,,
"What Aerosmith song are the following lyrics from: âGet ready for the big time, tap dancing on a land mineâ?",Rag Doll,Rag Doll,Angel,Walk This Way,Cryin
"What is the missing word in these lyrics by Aerosmith: âI was _____ when I met you, now Im dying to forget youâ?",Cryin,Angry,Crazy,Cryin,Sad
"What song by Aerosmith has the following lyrics: You talk about things that nobody cares, youâre wearing out things that nobody wears?",Sweet Emotion,Dream On,Sweet Emotion,Amazing,Janies Got A Gun
"The following lyrics are from the song Amazing by Aerosmith: Lifes a journey, not a destination, and theres just no telling what tomorrow brings.",True,False,True,,
"What Aerosmith song are the following lyrics from: That kind of lovin, sends a man, to his grave?",Crazy,Cryin,Love In An Elavator,Crazy,Angel
What is the most popular nickname of TV talk show host Jay Leno?,The Chin,The Boss,The Grandpa,The Wig,The Chin
Justin Timberlakes very curly blond hair has earned him this funny nickname.,Curly Spice,Perm,Surly-Curly,Curly Spice,Noddle Hair
What was the reason Madonna was called Madge in Great Britain?,It is short for Your Majesty,Because she mentions Joe DiMaggio in her song Vogue,It is just a pet name for Madonna,It is short for Your Majesty,Because she resembles Mary Magdalene
What is actress Courtney Coxs nickname that she was given by her family and friends as a child?,CeCe,Tsetse,CeCe,Coxie,CoCo
"Reportedly president George W. Bush liked to call himself this, being a big fan of nicknames.",The Decider,The Decider,The Big Brother,The Manager,The Big Bad Boss
Gwen Stefani has been called this nickname because of her smile and her signature platinum blond hair.,Sunshine,Sunshine,Sunrise,Barbie,Marilyn
What female singer has been called Booty because of her impressive buttocks?,Janet Jackson,Shakira,Beyonce,Jennifer Lopez,Janet Jackson
What nickname was given to actor Charlie Sheen which rhymes with his last name?,Masheen,Teen,Spleen,Mean,Masheen
Aerosmiths lead singer Steven Tyler was called this nickname to refer to his powerful voice and signature vocalization.,Demon of Screaming,Soundwave,The Deafening Monster,Demon of Screaming,Gigahertz
What American actor was given the ingenious nickname Italian Stallion?,Sylvester Stallone,Robert De Niro,Leonardo DiCaprio,Sylvester Stallone,Ray Liotta
For which film did Frank Sinatra get his Oscar?,From Here to Eternity,Suddenly,Kings go Forth,From Here to Eternity,Can-Can
Which film starring Frank Sinatra was based on the life of the comedian Joe E. Lewis?,The Joker is Wild,The Tender Trap,Pal Joey,The Joker is Wild,Meet Danny Wilson
In which movie did Frank Sinatra make his starring debut?,Higher and Higher,Higher and Higher,Take Me Out to the Ballgame,Miracle of the Bells,On the Town
Which of these movies stars both Doris Day and Frank Sinatra?,Young at Heart,On the Town,The Tender Trap,Oceans 11,Young at Heart
Name the 1955 film in which Frank Sinatra co-starred with Debbie Reynolds and David Wayne.,The Tender Trap,The Pride and the Passion,The Lady in Cement,The Tender Trap,The Devil at 4 OClock
Which of these is a Rat Pack film starring Frank Sinatra set in the Old West?,Sergeants Three,Dirty Dingus McGee,Assult on a Queen,The Miracle of the Bells,Sergeants Three
Which western spoof co-starred George Kennedy and Frank Sinatra as an outlaw with a $10.00 (ten dollar) price on his head?,Dirty Dingus McGee,Way Out West,Dirty Dingus McGee,Miracle of the Bells,Suddenly
In which film did Frank Sinatra play the owner of a naughty Parisian night spot?,Can-Can,The French Twist,The Joker is Wild,I Remember Paris,Can-Can
Which 1966 Frank Sinatra films plot centred around a heist on an ocean liner?,Assault on a Queen,War and Peace at Sea,Assault on a Queen,Oceans Eleven,The Cruise Ship Caper
"In which film did Frank Sinatra and Jules Munshin sing the emblematic theme song New York, New York?",On the Town,In Old New York,On the Town,"New York, New York",Wonderful Town
In which Frank Sinatra film did Old Blue Eyes play Nathan Detroit?,Guys and Dolls,On the Town,Can-Can,Guys and Dolls,"New York, New York"
"Which movie, for which Frank Sinatra was already cast, saw him pull out when he learned he would have to film each scene in two different technologies?",Carousel,Carousel,My Fair Lady,Guys and Dolls,Oklahoma
When and where was Robert Duvall born?,"January 5, 1931in SanDiego, California","January 5, 1931in SanDiego, California","January 5, 1951in Dumont, Texas","January 5, 1956 in Des Moines, Iowa","January 5, 1941in Annapolis, Maryland"
"Which statement is incorrect about Luciana Pedraza, Robert Duvalls fourth wife?","She was born in Verz Cruz, Mexico.",She is over 40 years younger than he is.,She was the writer and director of the movie Portrait of Billy Joe.,She and Robert are avid Tango dancers.,"She was born in Verz Cruz, Mexico."
Robert Duvall and his good friend Dustin Hoffman studied with the same famous acting  teacher. Who was he?,Sanford Meisner,Sanford Meisner,Uta Hagen,Lee Strassberg,Tyrone Guthrie
Robert Duvalls acting teacher got him a part in the play The Midnight Caller. Who was the author of this play?,Horton Foote,Tom Stoppard,Sanford Meisner,David Mamet,Horton Foote
Robert Duvall was the first actor to play Major Frank Burns.,True,False,True,,
For which of these movies did Robert Duvall win the Best Actor Oscar?,Tender Mercies,The Godfather,The Apostle,Apocalypse Now,Tender Mercies
Robert Duvall is known to be aligned with which political party?,The Republican Party,The Republican Party,The Green Party,The Libertarian Party,The Democratic Party
"In the Godfather movies, how many men did Robert Duvalls character personally kill?",0,1,5,0,2
"In which movie does Robert Duvall not portray Lt. Col. Meacham, a fighter pilot?",The Pilot,The Gift of Fury,The Ace,The Great Santini,The Pilot
