question,answer,A,B,C,D
What animal did Alec Baldwin voice in the 2001 comedy movie Cats  Dogs?,Dog,Mouse,Guinea pig,Dog,Cat
In what 2006 spy movie did Alec Baldwin star as FBI Agent Sam Murach?,The Good Shepherd,The Last Shot,The Good Shepherd,Mercury Rising,State and Main
Tom Cruise received his first Academy Award nomination for his outstanding performance in this 1989 movie.,Born on the Fourth of July,Rain Man,Born on the Fourth of July,A Few Good Men,Top Gun
In what movie did Tom Cruise portray Dr. Bill Harford?,Eyes Wide Shut,Minority Report,Magnolia,Eyes Wide Shut,The Color of Money
Tom Cruises performance in the 2005 movie War of the Worlds brought him a nomination for this award.,Golden Raspberry Award,Golden Globe Award,All of these,Golden Raspberry Award,Academy Award
"What is the occupation of Jerry Maguire, portrayed  by Tom Cruise in the 1996 movie Jerry Maguire?",Sports agent,Sports agent,Rugby player,Baseball player,American football coach
"What is the offensive title of the book written by Frank T.J. Mackey, played by Tom Cruise, in the 1999 movie Magnolia?",Seduce And Destroy,How To Get Laid For Less Money,She Is Only After Your Wallet,The Superior Sex,Seduce And Destroy
"How does Tom Cruises character, David Aames, get disfigured in the 2001 movie Vanilla Sky?",In a car crash,He was burned with acid as a child.,None of these,In a car crash,His ex-girlfriend cuts his face out of jealousy.
What is the name of the character portrayed by Tom Cruise in the Mission: Impossible movie series?,Ethan Hunt,Ethan Hawke,Ray Ferrier,Jim Phelps,Ethan Hunt
What is the title of the 2003 movie in which Tom Cruise starred as war veteran Captain Nathan Algren?,The Last Samurai,The Last Warrior,The Last Soldier,The Last Ninja,The Last Samurai
In which 1992 drama movie did Tom Cruise star opposite Jack Nicholson and Demi Moore?,A Few Good Men,Mission: Impossible II,A Few Good Men,Top Gun,Born on the Fourth of July
What is the nickname of Tom Cruises character in the 1986 movie Top Gun?,Maverick,Iceman,Maverick,Cougar,Viper
"Duke Ellington was born on April 29, 1899 in which city?","Washington, D.C.","Baltimore, Maryland","Washington, D.C.","Atlanta, Georgia",New York City
"This book, published in 1973, is Duke Ellingtons autobiography.",Music Is My Mistress,Ellington:In A Mellow Mood,Music Is My Mistress,Sir Duke,The Duke From Baltimore
"According to Duke Ellingtons autobiography, his childhood dream was what?",To be a baseball player,To play the piano,To play the violin,To be an actor,To be a baseball player
Jazz musician Duke Ellington attended which high school?,Armstrong Manual Training School,Peebles High School,Armstrong Manual Training School,Grand Valley High School,West Union High School
"In 1917, Duke Ellington formed his first music group, named what?",The Dukes Serenaders,The Dukes Serenaders,The Orioles,The Moochers,The Washingtonians
"In 1927, Duke Ellington and his band, The Washingtonians were offered a permanent job at which famous Harlem club?",The Cotton Club,The Hollywood Club,The Cotton Club,The Savoy Ballroom,The Apollo
"This composer and pianist wrote Take the A Train, which became the signature tune of Duke Ellington.",Billy Strayhorn,Fats Navarro,Fats Waller,Billy Strayhorn,Billie Holiday
Which of these is not a famous piece by Duke Ellington?,One OClock Jump,One OClock Jump,Mood Indigo,Such Sweet Thunder,Sophisticated Lady
Which of these prominent musicians did not play in Duke Ellingtons orchestra?,Freddie Green,Sonny Greer,Ray Willis Nance,Harry Carney,Freddie Green
"Which statement, concerning the awards and honors received by Duke Ellington, is true?",All of these are true,He was awarded the Legion of Honor by France in 1973,He was awarded the Presidential Medal of Freedom,A 22 cent commemorative stamp with his name and picture was issued in 1986,All of these are true
When was Gary Cooper born?,1901,1931,1941,1901,1921
From what disease did Gary Cooper die?,Cancer,Cancer,Heart attack,Malaria,Liver infection
In which Hall of Fame was Gary Cooper inducted?,National Cowboy and Western Heritage Museum,The ASCAP Hal of Fame,The Screen Actors Guild  Hall of Fame,The National Hall of Great Americans,National Cowboy and Western Heritage Museum
How did Frank James Cooper become Gary Cooper?,"His agent was born in Gary, Indiana.",He was given that name by Ron Howard.,His football coach at UCLA gave him the name.,"Spencer Tracy said, He looks like a Gary.","His agent was born in Gary, Indiana."
How many times was Gary Cooper married?,Once to a woman not in show  business,"Three times: to Marlene Dietrich, Patricia Neal, and Gloria Swanson",Once to a woman not in show  business,"Four times: to Clara Bow, Evelyn Brent, Carole Lombard, and Ingrid Bergman",Never
Which two movies earned Gary Cooper Academy Awards?,Sergeant York and High Noon,Mr. Deeds Goes to Town and Today We Live,A Farewell to Arms and For Whom the Bells Toll,The Plainsman and The Westerner,Sergeant York and High Noon
Gary Cooper was present when an escalator was put into a movie theater for the first time.,True,True,False,,
Gary Cooper is referenced in an Irving Berlin song.,True,False,True,,
Gary Cooper starred in A Farewell to Arms and For Whom the Bell Tolls. What do these movies have  in common?,They are based on novels by Ernest  Hemingway.,They are based on novels by Ernest  Hemingway.,They both co-starred John Wayne.,They both were directed by Fritz Lang.,They are based on novels by John Steinbeck.
1939 has often been described as a banner year for movies. Which of these 1939 movies starred Gary Cooper?,Beau Geste,The Wizard of Oz,Beau Geste,Stagecoach,Gone With the Wind
"Although John Wayne and Gary Cooper were good friends, John Wayne hated this Gary Cooper role.",Will Kane in High Noon,Cole Harden in The Westerner,Will Kane in High Noon,Casanova Brown in Casanova Brown,Ashley Wilkes in Gone With the Wind
Gary Cooper is famous for his portrayal of this athlete.,Lou Gehrig,Lou Gehrig,Jim Thorpe,Alvin York,Babe Ruth
Gary Cooper appeared at the House Un-American Activities Committee in the 1950s. Which best describes his testimony?,He said he feared Communism but did not mention any names.,He named ten writers who were Communists.,He said he feared Communism but did not mention any names.,He said there was no danger from Communism in Hollywood.,He named ten people in Hollywood who were Communists.
Gary Cooper was a man of many hobbies. Which of these was one of them?,taxidermy,taxidermy,chess,poetry,stamp collecting
"Before becoming a star, Gary Cooper was a guide in this US Park.",Yosemite,Grand Teton,Yellowstone,Yosemite,Mount Rushmore
Find the incorrect statement concerning Gary Cooper.,John Wayne learned to ride a horse from Gary Cooper.,Tony Soprano often referred to Gary Cooper as the strong silent  type.,A poster of Cooper was used to help win free elections in Poland.,John Wayne learned to ride a horse from Gary Cooper.,Gary Coopers daughter once spat at the actress Patricia Neal.
"By some quirk of  fate, Gary Cooper was distantly related to this actress.",Brooke Shields,Brooke Shields,Holly Hunter,Kyra Sedgewick,Michelle Pfeiffer
"Five individuals were the regular hosts of this radio theatre program, that ran from 1979-1981. Richard Widmark was the Friday night adventure host.",Sears Radio Theatre,Wells Fargo Theatre,RKO,Wagon Train Theatre,Sears Radio Theatre
Actor Richard Widmark nearly lost an important part because his ears were too big.,False,False,True,,
Richard Widmarks daughter was married to this baseball great.,Sandy Koufax,Roger Maris,Sandy Koufax,Joe Dimaggio,Mark McGuire
"When Richard Widmark married his second wife, he became the step-father to Amy. Amy was the daughter of Susan Blanchard and this actor legend.",Henry Fonda,Fred MacMurray,Henry Fonda,Glen Ford,James Stewart
Why was Richard Widmark unable to serve in the military during WWII?,perforated eardrum,flat feet,perforated eardrum,asthma,poor eyesight
"Richard Widmark starred in this movie in the 70s, that was an adaptation of a book by Agatha Christie.",Murder on The Orient Express,"And, Then There Were None","One Little, Two Little, Three Little Indians",Darkness Inconvenienced,Murder on The Orient Express
"Richard Widmark appeared on I Love Lucy as himself, in an episode in which Lucy pretends to be infatuated with Widmark.",True,True,False,,
In what eastern state was actor Ron Perlman born?,New York,Florida,Virginia,Maryland,New York
Ron Perlman has done s a lot of voice over work in cartoons and games. Which of the following is not one of his projects?,Superman,Lord Terrence Hood,Jagger Valance,Clayface,Superman
"In 2008, Ron Perlman became the oldest actor to play a main superhero.",True,False,True,,
Ron Perlman played Bernie Marx back in the 70s on this daytime soap opera.,Ryans Hope,Knots Landing,Days of Our Lives,General Hospital,Ryans Hope
What movie starring Ron Perlman is this exchange from?,Hellboy,Hellboy,Beauty and the Beast,Alien,The Last Super
"Revolutions studio wanted someone like Vin Diesel to play the part of Hellboy, but it was eventually given to Ron Perlman.",True,False,True,,
Ron Perlman did not win an Emmy for the TV series Beauty and the Beast.,True,True,False,,
In which of these films did Ron Perlman co-star with Wesley Snipes?,Blade II,Blade II,Blade III,Art of War,Aliens
"Microsoft co-founder William Henry Gates III, a.k.a. Bill Gates, was born on October 28, 1955 in this US state.",Washington,Arizona,Kentucky,Washington,Delaware
"TV host and actress Oprah Winfrey was born on January 29, 1954 in this US state.",Mississippi,Minnesota,Michigan,Mississippi,Missouri
"In what country was Academy Award winner Robert De Niro born on August 17, 1943?",the United States,Germany,the United States,Australia,Italy
"Writer Agatha Christie, who became the best-selling author of all time, was born in this country on September 15, 1890.",England,Wales,Ireland,England,Scotland
"Soccer star David Beckham was born on May 2, 1975 in what English city?",London,Birmingham,London,Manchester,Liverpool
"Singer and songwriter Celine Dion was born on March 30, 1968 in this country.",Canada,Belgium,France,the United States,Canada
"The 44th President of the United States Barack Obama was born on August 4, 1961 in this US state.",Hawaii,California,Hawaii,Florida,Texas
"Legendary actress Greta Garbo was born on September 18, 1905 in this European country.",Sweden,Sweden,Switzerland,Finland,Denmark
"In what US state was music legend Ray Charles born on September 23, 1930?",Georgia,Colorado,Maryland,Georgia,Florida
"Hollywood actor Omar Sharif was born on April 10, 1932 in this African country.",Egypt,Egypt,Morocco,Libya,South Africa
This Baldwin met his future wife on the set of The Marrying Man in 1991.,Alec,Alec,William,Daniel,Stephen
"Which Baldwin was born May 12, 1966, making him the youngest of the brothers?",Stephen,William,Alec,Daniel,Stephen
In 1993 this Baldwin was cast in the Baltimore-based cop show Homicide: Life on the Street.,Daniel,Alec,Stephen,WIlliam,Daniel
"This Baldwin appeared in the 1990 movie Flatliners, as Joe Hurley.",William,Daniel,Stephen,Alec,William
Alec Baldwin starred in the 1995 movie The Usual Suspects.,False,False,True,,
Three of the four Baldwin brothers appeared in the 1989 movie Born On The Fourth of July.,True,False,True,,
Which Baldwin starred in the 1996 movie Mulholland Falls with Nick Nolte?,Daniel,William,Daniel,Stephen,Alec
There are no sisters to the Baldwin brothers.,False,False,True,,
"In 1960s The Alamo, John Wayne played this famous frontiersman.",Colonel Davy Crockett,Colonel William Travis,Colonel Jim Bowe,Colonel Davy Crockett,General Sam Houston
Julia Roberts was the first actress to appear on the cover of this popular magazine.,Vogue,Elle,Cosmopolitan,Harpers Bazaar,Vogue
What was the occupation of Julia Roberts parents when they first met?,Actors and playwrights,Actors and playwrights,Professional dancers,Fashion designers,Butchers
What musical instrument did Julia Roberts learn to play when she was a student?,Clarinet,Flute,Trombone,Clarinet,Violin
What was Julia Roberts dream job when she was a little girl?,Veterinarian,Model,Astronaut,Singer,Veterinarian
"In what movie, released in 1989, did Julia Roberts make her acting debut?",Blood Red,Mystic Pizza,Lonely Traveler,Blood Red,Blue Sunrise
What disease did Julia Roberts character have in the 1989 dramedy movie Steel Magnolias?,Diabetes,Diabetes,Cancer,Tuberculosis,AIDS
"What name did Julia Roberts give to her first-born daughter who was born on November 28, 2004, together with her fraternal twin brother?",Hazel,Ginger,Hazel,Apple,Coco
What famous actor did Julia Roberts date before she married cameraman Daniel Moder?,All of these,Liam Neeson,Benjamin Bratt,All of these,Matthew Perry
What type of character did Julia Roberts voice in the 2006 computer-animated movie The Ant Bully?,A nurse ant,A worker ant,Queen ant,A nurse ant,A little girl
What was the name of Julia Roberts character in the 1991 Steven Spielberg movie Hook?,Tinker Bell,Wendy Darling,Princess Galathea,Tinker Bell,Medea
What is Christopher Walkens real first name?,Ronald,George,Ronald,Harry,Edward
What did Christopher Walken eat for an entire week in order to prepare for his role in the 1978 movie The Deer Hunter?,Rice and bananas,Rice and bananas,Eggs,Steamed broccoli,Chicken and pork
In what Madonna video has actor Christopher Walken made an appearance?,Bad Girl,Youll See,Bad Girl,Oh Father,All of these
What is the name of actor Christopher Walkens first-born child?,None of these,Sandra,Deborah,None of these,Matthew
Complete the following popular phrase that originated from Chris Walkens performance in an episode of Saturday Night Live:,Cowbell,Cowbell,Jackass,Booty,Beehive
What character did actor Christopher Walken portray in the 1992 movie Batman Returns?,Max Shreck,Chip Shreck,Max Shreck,The Penguin,The Mayor
What animated character did Christopher Walken voice in the 1998 animated movie Antz?,Colonel Cutter,Colonel Cutter,General Mandible,Z,Weaver
In what Denzel Washington movie did Christopher Walken appear as Denzels ex-colleague from CIA?,Man on Fire,Man on Fire,The Bone Collector,American Gangster,Training Day
"In what movie did Christopher Walken play the role of a World War II veteran and father of Frank Abagnale, Jr.?",Catch Me If You Can,Catch Me If You Can,The Opportunists,Last Man Standing,The Funeral
"What legendary musician was the main character in the 1995 play Him, written by Christopher Walken?",Elvis Presley,John Lennon,Jimi Hendrix,Fred Astaire,Elvis Presley
Which state was American actress and singer Hilary Duff born in?,Texas,New York,Kansas,California,Texas
Which of these is a name of one of Hilary Duffs albums?,Most Wanted,Most Wanted,In Love,Broken,Fly
"In which of these movies does Hilary co-star with her sister, Haylie Duff?",Material Girls,Cadet Kelly,Material Girls,Parent Trap,The Perfect Man
When was Hilary Duff born?,"September 28th, 1987","October 28th, 1987","August 5th, 1986","November 29th, 1985","September 28th, 1987"
"Alternative rock band, Weezer has had the same members throughout their career.",False,False,True,,
"Where is the name of alternative rock band, Weezer derived from?",Rivers Cuomos childhood nickname,Rivers Cuomos childhood nickname,The street one of the members lived on,It doesnt mean anything,Patrick Wilsons grandfather
"Rivers Cuomo of the band, Weezer, has converted to Buddhism.",False,False,True,,
"Directed by Spike Jonze, this was the first video of alternative rock band, Weezer.",Undone (The Sweater Song),Say it Aint So,Island in the Sun,Undone (The Sweater Song),Buddy Holly
"Finish the lyric by American alternative rock band, Weezer:",Undone (The Sweater Song),,,,
"Finish the lyric by American alternative rock band, Weezer:",reach out there and grab it,reach out there and grab it,take up a new habit,see it and stab it,meditate about it
"What was the first video of the band, Weezer, that Scott Shriner was featured in?",Photograph,Keep Fishin,Photograph,Island in the Sun,Dope Nose
Who directed the video for Weezers Say It Aint So?,Sophie Muller,Mark Romanek,Sophie Muller,Anton Corbijn,Spike Jonze
"How many animals and insects are referenced on Weezers second album, Pinkerton?",11,3,2,11,7
"Michael Jackson was born in this US state on August 29, 1958.",Indiana,Virginia,Louisiana,Maryland,Indiana
"John F. Kennedy, 35th President of the United States, was born in this US state on May 29, 1917.",Massachusetts,Nevada,North Carolina,Utah,Massachusetts
"In what US city was Academy Award winner Jane Fonda born on December 21, 1937?",New York City,Los Angeles,New York City,Houston,Boston
Composer Ludwig van Beethoven was born around 16 December 1770 in this German city.,Bonn,Dusseldorf,Bonn,Berlin,Hamburg
"In what Latin American country was revolutionary Che Guevara born on June 14, 1928?",Argentina,Bolivia,Mexico,Argentina,Cuba
"Film legend Charlie Chaplin was born on April 16, 1889 in this country of the United Kingdom.",England,Ireland,Wales,Scotland,England
"In what US state was The King of Rock n Roll Elvis Presley born on January 8, 1935?",Mississippi,Texas,Missouri,South Carolina,Mississippi
"In what country was Academy Award-winning actor Anthony Hopkins born on December 31, 1937?",Wales,Scotland,England,Wales,Ireland
"In what European country was Oscar-winning actress Audrey Hepburn born on May 4, 1929?",Belgium,France,England,Belgium,Netherlands
"Academy Award winner Tom Hanks was born on July 9, 1956 in this US state.",California,Florida,California,New York,Pennsylvania
Which statement is true about Will Lee?,"He was born in Brooklyn, New York in 1908.","He was born in Philadelphia, PA, in 1922.",He was born in Pittsburgh in 1916.,"He was born in Halifax, Nova Scotia in 1919.","He was born in Brooklyn, New York in 1908."
"Of course, Will Lees most famous role was that of Mr. Hooper on Sesame Street. What was Mr. Hoopers first name?",Harold,Hector,Harold,Herman,Henry
Which member of Sesame Street had a lot of trouble saying Mr. Hooper?,Big Bird,Bert,Big Bird,Cookie Monster,Ernie
Who ran the store on the childrens show Sesame Street immediately after Mr. Hoopers death?,David and Gina,David and Gina,Maria and Luis,Bert and Ernie,Alan and Mary
"In episode 335 of Sesame Street, Alan went on vacation. Who ran the store while he was away?",Natalie,Natalie,Bob and Kermit,Big Bird,Maria and Luis
Will Lee began his acting career doing Broadway musicals.,False,True,False,,
"Just like many fine American actors, Will Lee was blacklisted from 1951-1956. Who was responsible for the blacklistings?",Senator Joseph McCarthy,Alan Dulles,Senator Joseph McCarthy,President Eisenhower,John Foster Dulles
In 1953 Will Lee appeared in this great American movie.,Little Fugitive,The Farmers Daughter,Little Fugitive,Pickup on South Street,Titanic
"In the 1930s, Will Lee was a member of this famous theater group.",The Group Theater,The American Repertory Troupe,The Group Theater,The Actors Studio,The Northwestern Actors Theater
"In 1980, Will Lee played Shmuel in this movie.",Playing for Time,Playing for Time,One Trick Pony,A Small Circle of Friends,Stardust Memories
"In what US state was the 43rd President of the United States George W. Bush born on July 6, 1946?",Connecticut,Texas,Kentucky,Connecticut,Oregon
"In what country was Academy Award winner Katharine Hepburn born on May 12, 1907?",United States,Australia,United States,United Kingdom,Canada
"Author and poet Oscar Wilde was born in this European country on October 16, 1854.",Ireland,Denmark,Ireland,Scotland,England
"Albert Einstein was born on March 14, 1879 on the territory of what present day country?",Germany,Switzerland,Hungary,Germany,Austria
"In what US state was Academy Award winner Meryl Streep born on June 22, 1949?",New Jersey,New Jersey,North Carolina,Virginia,Maine
"Madonna Louise Ciccone, known as simply Madonna, was born on August 16, 1958 in this country.",the United States,Italy,the United States,Mexico,Spain
"In what US state was movie director and producer Steven Spielberg born on December 18, 1946?",Ohio,Tennessee,Mississippi,Oregon,Ohio
"In what country was composer Johann Sebastian Bach born on March 31, 1685?",Germany,Switzerland,Germany,Austria,Hungary
"African-American civil rights movement leader Martin Luther King, Jr. was born in this US state on January 15, 1929.",Georgia,Alabama,Louisiana,Georgia,Illinois
"Academy Award winner Dustin Hoffman was born on August 8, 1937 in this US city.",Los Angeles,San Francisco,New York,Chicago,Los Angeles
What did supermodel Naomi Campbell study in the Italia Conti Academy where she was accepted at the age of 10?,Ballet,Fashion design,Acting,Painting,Ballet
What popular fashion brand did supermodel Christy Turlington represent from 1987 to 2007?,Calvin Klein,Versace,Calvin Klein,Ralph Lauren,Armani
In what popular Macaulay Culkin movie has supermodel Claudia Schiffer made an appearance?,Richie Rich,Home Alone 2: Lost in New York,My Girl,Richie Rich,Party Monster
Supermodel Cindy Crawford won an academic scholarship to major in this field at Northwestern University.,Chemical engineering,Chemical engineering,Medicine,Physics,Information technology
What is the name of supermodel Kate Moss daughter born on 29 September 2002?,Lila,Lenee,Leona,Lily,Lila
"What fashion designer called supermodel Linda Evangelista top of the tops and stated, There is not another model in the world as professional as she is?",Karl Lagerfeld,Stefano Gabbana,Roberto Cavalli,Karl Lagerfeld,John Galliano
In what popular TV sitcom did supermodel Elle Macpherson make a guest appearance in 1999?,Friends,Friends,Will And Grace,Two Guys and a Girl,Veronicas Closet
What actress did supermodel Tyra Banks co-star with in the 2000 Disney film Life-Size?,Lindsay Lohan,Hilary Duff,Ashley Olsen,Lindsay Lohan,Dakota Fanning
What member of Bon Jovi did model Eva Herzigova marry in September 1996?,Tico Torres,David Bryan,Jon Bon Jovi,Tico Torres,Richie Sambora
Model Helena Christensen admitted she was addicted to this food and was even considering getting a shoulder tattoo of it.,Cheese,Fish,Broccoli,Mushrooms,Cheese
"What popular person once said, The history of dance on film begins with Astaire?",Gene Kelly,Kirk Douglas,Marlon Brando,Gene Kelly,Steven Spielberg
What musical instrument did Fred Astaire learn to play when he was a child?,All of these,All of these,Accordion,Clarinet,Piano
Where did Fred Astaire and his sister Adele suposedly take their stage name Astaire from?,From their uncles name,From their uncles name,From their dance instructor,From a book character,From the name of a cafeteria
What did Fred Astaires screen test report for RKO Pictures read according to him?,Cant act.,Cant act.,Cant talk.,Cant dance.,Cant sing.
"What is the name of Fred Astaires first-born child, born in 1936?","Fred, Jr.",Ava,Phyllis,Peter,"Fred, Jr."
How did Fred Astaire break his wrist when he was seventy-eight?,He fell from his grandsons skateboard.,He fell from a bicycle.,He slipped by the swimming pool.,He fell from his grandsons skateboard.,He lost balance while doing a headstand.
What peculiar clause does Fred Astaires will contain?,He should never be portrayed in films.,All his money and possessions should go to charity.,He should never be portrayed in films.,His favorite horse should be buried with him.,His daughter should never get married if she wants to inherit his fortune.
What animal costume did young Fred Astaire wear at his first ever stage performance?,Lobster costume,Ant costume,Frog costume,Lobster costume,Bear costume
What award did Fred Astaire receive from his long-time professional partner Ginger Rogers in 1950?,Academy Award,Nobel Prize,Emmy Award,Grammy Lifetime Achievement Award,Academy Award
What legendary actress starred alongside Fred Astaire in the 1957 musical movie Funny Face?,Audrey Hepburn,Audrey Hepburn,Grace Kelly,Marilyn Monroe,Ginger Rogers
What is Kirk Douglas birth name?,Issur Danielovitch,David Mois,Dmitri Sanglel,Izzy Demsky,Issur Danielovitch
What job did Kirk Douglas have before he turned to acting?,Newspaper boy,Wrestler,All of these,Newspaper boy,Gardener
In which war did Kirk Douglas participate after he joined the U.S. Navy?,World War II,World War II,Vietnam War,All of these,Korean War
How many children did Kirk Douglas father?,Four,Four,One,Two,Seven
What famous painter did Kirk Douglas portray in the 1956 movie Lust for Life?,Vincent Van Gogh,Rembrandt,Vincent Van Gogh,Paul Gauguin,Pablo Picasso
What expression did Kirk Douglas use to describe the majority of characters he has played in movies?,Sons of bitches,Nasty bastards,None of these,Slimy thugs,Sons of bitches
In what movie did Kirk Douglas portray manipulative film producer Jonathan Shields?,The Bad and the Beautiful,The Bad and the Beautiful,For Love or Money,Is Paris Burning,Man Without a Star
"Which popular Jules Verne character did Kirk Douglas portray in the 1954 movie 20,000 Leagues Under the Sea?",Ned Land,Conseil,Professor Pierre Arounax,Ned Land,Professor Pierre Arounax
What accident did Kirk Douglas survive in 1991?,Helicopter crash,Plane crash,Shipwreck,Car crash,Helicopter crash
What character did Kirk Douglas portray in the 1949 movie Champion that brought him his first Oscar nomination?,Boxer,Baseball player,Sprinter,Boxer,Horse rider
"Actor and director George Clooney was born on May 6, 1961 in this US state.",Kentucky,Ohio,Delaware,Kentucky,Kansas
What medical condition did George Clooney develop when he was a student?,Bells palsy,Dyslexia,All of these,Insomnia,Bells palsy
George Clooney tried to play this sport professionally when he was younger.,Baseball,Tennis,Rugby,Baseball,Football
Actor and director George Clooney planned to start a career in this field when he was a student.,Law,Medicine,Law,Psychology,Computer technology
