question,answer,A,B,C,D
"Robin Williams started his acting career as a stand-up comedian, performing for tips only.",True,True,False,,
Which of the following movies did Robin Williams not appear in?,The Bridges of Madison county,The World according to Garp,Popeye,The Bridges of Madison county,The Birdcage
How many children does Robin Williams have with his first wife?,1,0,3,2,1
Robin Williams had a serious addiction to cocaine.,True,True,False,,
Robin Williams older brother died in 2007. What was the cause of his death?,Complications from heart surgery,Drug overdose,Complications from heart surgery,Car accident,Lung Cancer
Paul McCartney wrote this Beatles tune reportedly about a real life event involving a member of the Moody Blues.,She Came in Through the Bathroom Window,I Want You (Shes So Heavy),She Came in Through the Bathroom Window,You Never Give Me Your Money,Why Dont We Do It in the Road
This Beatles song is from the Yellow Submarine album (1969) and written by John Lennon.,Hey Bulldog,Honey Pie,Lady Madonna,Hey Bulldog,Its All Too Much
This psychedelic song by George Harrison was originally meant to be included on the Sgt. Peppers Lonely Hearts Club Band album.,Only a Northern Song,Tomorrow Never Knows,Savoy Truffle,Only a Northern Song,Blue Jay Way
Which Beatles album is the song featured in the sound clip found on?,Let It Be,Rubber Soul,The White Album,Abbey Road,Let It Be
This White Album tune is about an old fairy tale that John Lennon remembered from his youth.,Cry Baby Cry,Rocky Raccoon,The Continuing Story of Bungalow Bill,Cry Baby Cry,"Ob-La-Di, Ob-La-Da"
This song from the Revolver album is about one of John Lennons first LSD trips.,She Said She Said,Doctor Robert,Tomorrow Never Knows,She Said She Said,Im Only Sleeping
"This Harrison tune was performed on the Beatles very last concert in Candlestick Park on August 29, 1966.",If I Needed Someone,Dont Bother Me,Do You Want to Know a Secret,If I Needed Someone,Taxman
This was the first song to be credited as being written by all four members of the Beatles.,Flying,Good Night,All Together Now,Flying,Good Day Sunshine
This song was the B-side of the A Hard Days Night single in the UK.,Things We Said Today,When I Get Home,Every Little Thing,I Should Have Known Better,Things We Said Today
"This song is reportedly about McCartneys muse, and appears on their White Album.",Martha My Dear,Mother Natures Son,Dear Prudence,Martha My Dear,I Will
"Mick Jagger was present during the recording of this song, and is thought to have contributed backing vocals.",Baby Youre a Rich Man,"Good Morning, Good Morning",And Your Bird Can Sing,Your Mother Should Know,Baby Youre a Rich Man
The Great Wall Marathon along the Great Wall of China is annually held in what month?,May,August,March,December,May
Which of the following was not invented in China?,Glass,Compass,Glass,Paper,Gunpowder
"What is the name of the science that studies China, Chinese history and Chinese culture?",Sinology,Chinology,Cynology,Sinology,Cinelogy
"Which of these statements about the giant panda, native to southern and central China, is true?",The giant pandas pupils are vertical slits.,The giant panda is not a bear but a large raccoon.,The giant panda hibernates.,The giant panda is also native to South America.,The giant pandas pupils are vertical slits.
Which of these variants of the Chinese language has the largest number of native speakers?,Mandarin,Mandarin,Wu,Cantonese,Xiang
Who was the first foreign political leader to visit the world-famous Shaolin temple in China?,Russian President Vladimir Putin,Russian President Vladimir Putin,UK Prime Minister Tony Blair,South African President Nelson Mandela,U.S. President George W. Bush
Which of these martial arts is not Chinese?,Taekwondo,Dragon Kung Fu,Shaolin Quan,Kuen-Do,Taekwondo
What two colours are featured on the national flag of the Peoples Republic of China?,Red and yellow,White and green,Red and white,Blue and yellow,Red and yellow
Which of these lines consists only of movies starring Chinese actress Zhang Ziyi?,"Memoirs of a Geisha, House of Flying Daggers","Crouching Tiger Hidden Dragon, Ballistic: Ecks vs. Sever","Memoirs of a Geisha, House of Flying Daggers","Hero, Kill Bill: Volume 1","Rush Hour 2, Charlies Angels: Full Throttle"
Which is the most populous city in the Peoples Republic of China?,Shanghai,Hong Kong,Nanjing,Beijing,Shanghai
Fill in the blank in this song by Elton John:,Shanghai,,,,
Fill in the blank in this song by Elton John:,Alice,Jeannie,Amy,Sarah,Alice
Name the girl mentioned in the song Crocodile Rock.,Suzie,Suzie,Silvia,Sandy,Stacy
What is the title of the song by Elton John which contains these lyrics?,Little Jeannie,Lady Samantha,Little Jeannie,Amy,Tiny Dancer
Who plays the organ in the Elton John song Sixty Years On?,Magdelena,Magdelena,Maggie May,Magellana,Mary Martha
What is the title of the song containing these lyrics?,Amy,Suzie,Samantha,Heather,Amy
Who glides over the hill in a long satin dress that she wears every day according to a song by Elton John?,Lady Samantha,Princess Brenda,Clementine,Sweet Rose,Lady Samantha
Whose song opens with these lines?,Michelles Song,Michelles Song,Little Jeannies Song,Maggie Thatchers Song,Lady Samanthas Song
"Halle Berry was born in Columbus, Ohio.",False,True,False,,
Ms. Halle Berry has been the executive producer on at least 2 projects.,True,True,False,,
Name Halle Berrys first movie. It was released in 1991 and her characters name was Vivian.,Jungle Fever,Strictly Business,Boomerang,Swordfish,Jungle Fever
What famous actress did Halle Berry portray in a 1999 television movie?,Dorothy Dandridge,Josephine Baker,Eartha Kitt,Dorothy Dandridge,Pearl Bailey
Halle Berry made several early appearances on television. Her first series role was in 1989 on this sitcom spinoff of Whos the Boss.,Living Dolls,Paradise,Whos Your Boss,Phenom,Living Dolls
"Halle Berry won Miss Teen All-American, Miss Ohio and Miss USA.",False,True,False,,
Name the movies in which Halle Berry has starred with Hugh Jackman.,"Swordfish, X-Men 1-3","X-Men 1-3, Die Another Day","Catwoman, X-Men 1  3","Swordfish, X-Men 1-3","Monsters Ball, X-Men 1-2, Executive Decision"
When was actor Orlando Bloom born?,"January 13, 1977","January 13, 1978","January 13, 1977","January 15, 1978","January 12, 1977"
What was Orlando Blooms first major screen role?,Legolas Greenleaf,Legolas Greenleaf,Joe Byrne,Will Turner,Hawkeye
Orlando Bloom made his film debut in the movie Wilde.,True,True,False,,
As a teenager Orlando Bloom was diagnosed with dyslexia.,True,False,True,,
What sign is Orlando Bloom according to the Chinese horoscope?,Dragon,Horse,Cock,Pig,Dragon
What role did Orlando Bloom play in the 2004 movie Troy?,Paris,Achilles,Menelaus,Paris,Hector
Orlando Bloom attended the Guildhall School of Music and Drama.,True,False,True,,
Broderick Crawford once played the role of J. Edgar Hoover.,True,True,False,,
How did Broderick Crawford die?,He had a series of strokes that proved fatal.,He committed suicide.,He was killed doing a stunt.,He suffered from cancer.,He had a series of strokes that proved fatal.
Broderick Crawford won an Academy Award for Best Actor in 1949 by playing the character of Willie Stark in which movie?,All The Kings Men,Rowdy Boys,All The Kings Men,Then Came a Fisherman,Route 66
How many stars does Broderick Crawford have on the Hollywood Walk of Fame?,2,2,1,4,0
Broderick Crawfords most notable role probably came as Chief Dan Matthews in which television program?,Highway Patrol,Adam 12,Dragnet,Route 66,Highway Patrol
What production did Broderick Crawfords Broadway acting career began on?,Of Mice and Men,Of Mice and Men,The Odd Couple,King Lear,Cats
What was the occupation of Broderick parents?,Vaudeville performers,Crawford was an orphan.,Teachers,A dock worker and a writer,Vaudeville performers
Broderick Crawford was often type-cast as in what specific role?,A rough talking tough guy,A dimwit,A father figure,A rough talking tough guy,A well-mannered bore
Broderick Crawford appeared on the American TV series CHiPs in at least one episode.,True,False,True,,
What year was Robert De Niro born?,1943,1948,1940,1945,1943
Which of the following is not a Robert De Niro movie?,The Departed,Mean Streets,Bang the Drum Slowly,The Departed,Taxi Driver
Robert De Niro is the co-founder of a film production company.,True,True,False,,
For which of these movies did Robert De Niro gain over 60 pounds?,Raging Bull,Casino,Raging Bull,The Godfather II,Goodfellas
Who did Robert De Niro say was his favorite actress to work with?,Meryl Streep,Meryl Streep,Juliette Lewis,Julia Roberts,None of These
What condition was Robert De Niro diagnosed with in 2003?,prostate cancer,lung cancer,none of these,heart disease,prostate cancer
"This comedian, who co-starred with Edward Gallagher in the vaudeville act Gallagher and Shean, was Marx Brothers uncle.",Al Shean,Al Shean,Max Shean,Franz Shean,Joseph Shean
"Who was the first of the Marx Brothers to go on stage in, 1905?",Groucho,Groucho,Manfred,Harpo,Chico
"Which of the Marx Brothers wore a red wig, carried a taxi-cab horn and never spoke?",Harpo,Chico,Zeppo,Gummo,Harpo
What were the first two talkie movies released by the Marx Brothers in 1929 and 1930?,The Cocoanuts and Animal Crackers,The Cocoanuts and Monkey Business,The Cocoanuts and Animal Crackers,Monkey Business and Horse Feathers,Humor  Risk and Animal Crackers
Which was the Marx Brothers first feature length movie that was not based on a Broadway show?,Monkey Business,The House That Shadows Built,Monkey Business,Horse Feathers,Duck Soup
What was the first movie that the Marx Brothers made for MGM with producer Irving Thalberg?,A Night at the Opera,Room Service,A Day at the Races,A Night at the Opera,Go West
Why did the Marx Brothers shoot the movies A Night at Casablanca and Love Happy?,They had to pay Chicos gambling debts.,They were trying a new formula with Groucho in the role of a villain.,They had to pay Chicos gambling debts.,None of these,They needed the money to pay back taxes.
What was the name of the TV special in which the Marx Brothers last appeared together in 1959?,The Incredible Jewel Robbery,The Incredible Jewel Robbery,The Show of Shows,The Incredible Brothers,The New Cocoanuts
"In 1955, Harpo, one of the Marx Brothers, appeared in a scene with Lucille Ball, on which popular sitcom?",I Love Lucy,The Man Who Came To Dinner,Duck Soup,I Love Lucy,I Love Betty
Which famous entertainer said that Steve Allen was so multi-talented that he could be on every page in the yellow page phone book?,Andy Williams,Dave Garroway,Andy Williams,Johnny Carson,Jack Paar
Which line presents Steve Allens date and place of birth?,"December 26, 1921, New York City","December 26, 1932, Drake, Iowa","December 26, 1926, Encino, California","December 26, 1935, Tempe, Arizona","December 26, 1921, New York City"
"Comedian Milton Berle often made Steve Allens mother, Belle Montrose what compliment?",She was the funniest woman in vaudeville,She was the best mother in vaudeville,She was the most beautiful woman in vaudeville,She had the best singing voice in vaudeville,She was the funniest woman in vaudeville
"Which famous expression did Steve Allen coin, while participating in a game show?",Is it bigger than a bread box?,Wanna buy a duck?,Is it bigger than a bread box?,Would you like to make a deal?,Who do you trust?
Which statement best describes Steve Allens personal life?,His first marriage lasted less than 10 years but his second was a 46-year one.,He was never married and had no children.,His first marriage lasted less than 10 years but his second was a 46-year one.,He was happily married to the same woman for almost 58 years.,"He was married six times, each ending in divorce."
"In the late 1950s, Steve Allen used what pseudonym for his music album?",Buck Hammer,Sol Yaged,Nat Hentoff,Al Cohn,Buck Hammer
In what year did Steve Allen introduce the First Tonight Show?,1956,1956,1952,1972,1960
Which of these innovation was instituted by Steve Allen on the Tonight Show?,He had a scientist as one of his regular visitors.,He had at least two musical guests on each show.,He had a dancing act once a week,He had a scientist as one of his regular visitors.,He played jazz piano on every show.
"According to the Guinness Book of World Records, how many songs did Steve Allen write in his life?","8,500","1,750","8,500","7,500","3,000"
Which of these songs was not written by Steve Allen?,The Tonight Show Theme,Gravy Waltz,The Tonight Show Theme,Pretend You Dont See Her,Cool Yule
What was the name of Steve Allens music company?,Meadowlane Music,AM Records,Allen Music Corporation of America,Meadowlane Music,Steverino Music
"What song by Steve Allen is played, when a football player is enshrined in the Pro Football Hall of Fame?",Ten Feet Tall,Meeting of Minds,Ten Feet Tall,The Wake,Reflections
When and where was Jerry Lewis born?,"3/16/1926 in Newark, NJ","3/16/1926 in Newark, NJ","3/16/1941 in Baltimore, MD","3/16/1936 in Paterson, NJ","3/16/1946 in Brooklyn, New York"
Jerry Lewis was thrown out of high school for hitting his principal.,True,False,True,,
Which is not one of the nicknames of Jerry Lewis?,The Loud One,Pichiatelli,Le Roi du Crazy,The King of Comedy,The Loud One
Which is the theme song of Jerry Lewis?,Rock-a Bye Your Baby,Its So Nice We Had This Time Together,"Laugh Clown, Laugh",Youll Never Walk Alone,Rock-a Bye Your Baby
Jerry Lewis has 5 biological children. How many of them are girls?,0,2,0,1,4
Jerry Lewis had a top 20 music album.,True,True,False,,
Jerry Lewis has often taught film classes in California. Which answer includes two of his students?,George Lucas and Steven Spielberg,George Lucas and Steven Spielberg,Francis Ford Coppola and Nicholas Cage,Martin Cortese and David Mamet,M.Night Shamlyn and Christopher Walken
For which of these awards was Jerry Lewis nominated in 1977?,The Nobel Peace Prize,The Nobel Prize in Literature,The Nobel Peace Prize,The Lifetime Achievement Award of the Tribeca Film Festival.,The Sundance Best Director Award
From which of these ailments has Jerry Lewis never suffered?,lung cancer,diabetes,prostate cancer,lung cancer,pulmonary fibrosis
Jerry Lewis was pronounced clinically dead in 1982.,True,False,True,,
"In the 1983 movie The King of Comedy, Robert DeNiro played the wanna-be comedian. He based his routine on the comedy of this actor.",Richard Belzer,Richard Lewis,Lenny Bruce,Mort Sahl,Richard Belzer
Which statement concerning Jerry Lewis is incorrect?,"After their breakup in 1956, Jerry Lewis and Dean Martin never appeared together.","After their breakup in 1956, Jerry Lewis and Dean Martin never appeared together.","Every Muscular Dystrophy Telethon has raised at least $1,000,000",One of Jerrys sons had a top ten hit with This Diamond Ring.,The character of Professor Frink on The Simpsons is based on Jerry Lewis.
Which of these English actors is not a member of the comedy group Monty Python?,Sir Anthony Hopkins,Graham Chapman,Terry Gilliam,Sir Anthony Hopkins,John Cleese
"What was the comedy show Saturday Night Live called, when it first aired on NBC?",NBCs Saturday Night,The Saturday Sketch Show,NBCs Saturday Night,The Saturday Night Show,Saturday Night Comedy
Which of these people wasnt impersonated by Dave Chappelle on the sketch program Chappelles Show?,Martin Luther King Jr.,George W. Bush,Lil Jon,Samuel L. Jackson,Martin Luther King Jr.
"This sketch comedy show, starring Aziz Ansari, Rob Huebel and Paul Scheer, premiered on MTV on April 5, 2007.",Human Giant,Human Giant,Wondershowzen,Funny or Die,Mind of Mencia
Which famous actor played the role of Bruce Dickinson in the famous Saturday Night Live sketch More Cowbell?,Christopher Walken,Al Pacino,Christopher Walken,Rober De Niro,Dustin Hoffman
Which famous funk singer did Dave Chappelle impersonate in the first sketch of the series Charile Murphys True Hollywood Stories?,Rick James,Rick James,Ike Turner,Michael Jackson,Isaac Hayes
The sketch comedy program Mr. Show with Bob and David was created by stand-up comedian David Cross and this actor.,Bob Odenkirk,Bob Saget,Bob Odenkirk,Bob Newhart,Bob Hope
Which of these actors was not among the cast of the Canadian sketch comedy show Second City Television?,Eddie Murphy,John Candy,Eddie Murphy,Eugene Levy,Joe Flaherty
The movie Monty Pythons Life of Brian was a parody of which of these Biblical stories?,the story of Jesus,the story of Joseph,the story of Jesus,the story of Noah,the story of Moses
Which of these famous American comedians served as the first host of Saturday Night Live?,George Carlin,Elliott Gould,Buck Henry,George Carlin,Richard Pryor
Walter Brennan won an Academy Award for playing this character in the John Wayne movie Rio Bravo.,Stumpy,Stumpy,Festus,Lumpy,Bull
What popular 50s rock and roll singer played the brother of John Waynes character in the movie North to Alaska?,Fabian,Elvis Presley,Bobby Vee,Ricky Nelson,Fabian
Name the three John Wayne movies in which Ben Johnson played a supporting character.,"Rio Lobo, She Wore a Yellow Ribbon, and The Undefeated","The Hellfighters, Big Jake, Chisum","Green Berets, Fort Apache, Train Robbers","Sands of Iwo Jima, Rio Grande, McClintock","Rio Lobo, She Wore a Yellow Ribbon, and The Undefeated"
"In this movie, John Wayne played aging US Cavalry Capt. Nathan Cutting Brittles.",She Wore a Yellow Ribbon,She Wore a Yellow Ribbon,Rio Grande,Fort Apache,Rio Lobo
"In the movie, The Quiet Man, John Waynes characters name was John Thorn.",False,True,False,,
"John Waynes nickname, Duke, derived from the name of his childhood dog.",True,False,True,,
Name the three movies in which John Wayne and Maureen OHara co-starred.,"McLintock, Big Jake, and Wings of Eagles","McLintock, Big Jake, and Wings of Eagles","She Wore a Yellow Ribbon, Rio Grande, and Red River","The Hellfighters, The Quiet Man, and The Undefeated","Green Berets, Rio Lobo, and The Man Who shot Liberty Valance"
Which of the following John Wayne characters is not correctly matched with the movie?,Major John Stryker in Sands of Iwo Jima,Major John Stryker in Sands of Iwo Jima,G.W. McLintock in McLintock,Chance Buckman in The Hellfighters,John Chisum in Chisum
What was the name of John Waynes horse in the movie True Grit?,Ol Blue,Star,Ol Buck,Ol Blue,Ol Blacky
What part did John Wayne play in the movie The Greatest Story Ever Told?,Roman Centurion,Roman Centurion,Apostle,Roman General,Roman Senator
"John Wayne played various roles, but he never portrayed a baseball player.",True,True,False,,
John Wayne costarred with Sophia Loren.,True,True,False,,
Which John Wayne character is correctly matched with the movie?,J.B. Books - The Shootist,Cord McNally - Rio Bravo,John T. Chance - Rio Lobo,J.B. Books - The Shootist,Chance Buckman - The Undefeated
"Tom Felton, who is popular for the role of Harry Potters principal rival, Draco Malfoy, was born on this date.","22 September, 1987","28 September, 1987","28 September ,1988","22 September, 1987","22 September, 1988"
At what age did Tom Felton start acting?,8,9,6,8,7
"Besides being an actor, Tom Felton is also a talented singer.",True,False,True,,
Tom Felton has sang with the Guildford Cathedral Choir.,False,False,True,,
Tom had read all the Harry Potter books before being cast as Draco Malfoy in the Harry Potter series.,False,True,False,,
"Originally, Tom Felton auditioned for the role of Harry Potter.",True,False,True,,
Duck hunting is one of Tom Feltons favourite pastimes.,False,True,False,,
What is Tom Feltons full name?,Thomas Andrew Felton,Thomas Louis-Andrew Felton,Thomas Louis Felton,Thomas Andrew Felton,Thomas Hunter Felton
"What piece of furniture did Frank Welker play in the the Oscar nominated, Disney masterpiece, Beauty and the Beast?",A footstool,A chair,A footstool,A dresser,A table
Which movie star beat out Frank Welker to become number one on Top 100 Stars of the 1980s list?,Harrison Ford,Tom Cruise,Dan Aykroyd,Harrison Ford,Eddie Murphy
Where was Debra Messing born?,"Brooklyn, New York","Brooklyn, New York","Santa Monica, California","Boston, Massachusetts","Providence, Rhode Island"
From which college did American actress Debra Messing graduate?,Brandeis,Brandeis,Northeastern,Boston College,Boston College
TV actress Debra Messing was voted Junior Miss of what state?,Rhode Island,Massachusetts,New York,Rhode Island,California
"Which actor and screenwriter did Debra Messing marry on September 3, 2000?",Daniel Zelman,Chad Zola,Ben Zwygmund,Daniel Zelman,Anthony Ziegler
The first TV show appearance of Emmy Award-winning actress Debra Messing was in which of these TV series?,NYPD Blue,NYPD Blue,Seinfeld,Law and Order,Home Improvement
On the TV series Seinfeldâ Jerry was very smitten with the character played by actress Debra Messing. What stood in Jerrys way?,She was married and anti-Semitic.,She was divorced three times.,She was married and anti-Semitic.,She was not a very neat person.,She wanted Jerry to change his job.
Will and Grace was perhaps Debra Messings most popular TV work. Whom did she beat out for the role of Grace Adler?,Nicollette Sheridan,Marcia Cross,Jamie Gertz,Nicollette Sheridan,Helen Hunt
Which of the following was Debra Messings first movie?,A Walk in the Clouds,Lucky You,A Walk in the Clouds,Purple  Violets,Open Season
Which was the first TV show in which American actress Debra Messing played the female leading role?,Ned and Stacey,Prey,Will and Grace,Celebrity,Ned and Stacey
Who played Grace Adlers mother in the Will and Grace TV series?,Debbie Reynolds,Laura Kightlinger,Leslie Ann Warren,Blythe Danner,Debbie Reynolds
Who portrayed Grace Adlers father in the Will and Grace TV series?,Alan Arkin,Sydney  Pollack,Kathleen Turner,Alan Arkin,Rip Torn
What was the name of character who married Grace in the sitcom Will and Grace?,Leo Markus,Leo Markus,Dr. Stuart Lamarack,Dr. Ben Doucette,Lyle Finster
How many Emmys did American actress Debra Messing win for Will and Grace?,1,6,1,4,3
In what year did Emmy Award-winning actress Debra Messing gave birth to her first child?,2004,2001,2002,2004,1998
"Actor Buster Keaton was born in Piqua, Kansas on October 4, what year?",1895,1875,1895,1885,1890
"When Buster Keaton was young, his vaudeville performance with his parents represented what situation?",His mother played saxophone while his father became angry and threw Buster around.,His mother yelled at Buster and his dad as they ran about the stage.,His mother played saxophone while his father became angry and threw Buster around.,His parents joked about raising a kid and then Buster would perform physical comedy.,His parents argued about raising a kid and then Buster would tell jokes.
Who nicknamed Joseph Frank Keaton Buster?,Harry Houdini,Charlie Chaplin,Harry Houdini,Florence Ziegfield,Cecille B. deMille
Why did actor Buster Keaton adopt his famous deadpan look?,Buster found that a deadpan look on his face made the audience laugh more.,Buster found that a deadpan look on his face made the audience laugh more.,Being thrown around finally drove Buster mad which showed as a deadpan look.,"One day, he was angry and refused to smile.",DeMille suggested it as an addition to the humor of the gags.
What made Buster Keaton and his mother put an end to the family vaudeville act?,The reason was Busters fathers alcoholism.,Buster wanted a bigger audience than the act could ever get.,The reason was Busters fathers alcoholism.,Travelling shows were outlawed in the USA.,The reason was that they didnt make enough money.
"In 1917, Buster Keaton befriended which American silent film actor?",Roscoe Fatty  Arbuckle,Oliver Norvel Hardy,W.C. Fields,Gloria   Emily Swanson,Roscoe Fatty  Arbuckle
"Buster Keaton produced, directed and starred in which 1924 comedy film?","Sherlock, Jr.",The Electric House,The Playhouse,"Sherlock, Jr.",One Week
Who was actor Buster Keatons first wife?,Natalie Talmadge,Constantine Talmadge,Norma Talmadge,Paullette Goddard,Natalie Talmadge
"Name Buster Keatons third wife, who was 23 years his senior and appeared with him in the Cirque Medrano in Paris in the 1940s and 1950s.",Eleanor Norris,Charlie Chaplin,Marilyn Chastain,Eleanor Norris,Audrey Hepburn
When did actor Buster Keaton die?,1966,1966,1976,1956,1946
When was John Wayne born?,"May 26, 1907","May 26, 1907","November 26, 1907","September 26, 1907","April 26, 1907"
Is it true that John Wayne had 6 children?,No,Yes,No,,
Was John Wayne offered the part of Matt Dillon on Gunsmoke?,No,Yes,No,,
"John Wayne requested that his tombstone read Feo, Fuerte y Formal. What does this mean in English?","Ugly, Strong and Serious",A Great Star,An American Cowboy,"The Good, the Bad, And the Ugly","Ugly, Strong and Serious"
For which of these movies was Jane Fonda nominated for best actress in a lead role?,The Morning After,Complicated Women,On Golden Pond,None of these,The Morning After
What was Flip Wilsons real name?,Clerow Wilson,Phillipe Wilson,Clerow Wilson,Anderson Forbes Wilson,Philander Smith Wilson
One of Flip Wilsons  most popular characters was Geraldine. Who was Geraldines boyfriend?,Killer,Killer,Jackie Lee,Rockefellar,Buster
Which statement concerning comedian Flip Wilson is untrue?,"In 2002, Flip made an unsuccessful sitcom on CBS.","In 2002, Flip made an unsuccessful sitcom on CBS.",Flip claimed that one of the homes he owned  was haunted.,There is a song about Flip called Nosliw Pilf.,Flip was one of 18 children.
Which two comedians were writers of the successful variety show called The Flip Wilson Show?,Richard Pryor and George Carlin,Richard Pryor and George Carlin,Bill Cosby and Richard Pryor,C.J. Watson and Bill Cosby,George Carlin and C.J. Watson
The Flip Wilson Show won two Emmys in 1971.,True,True,False,,
What did Flip Wilsons character Geraldine say when she was caught doing something wrong?,The devil made me do it!,That couldnt be me!,"Well, dont just look at me!",The devil made me do it!,You betta be looking at me because Im  beautiful!
