question,answer,A,B,C,D
"What is the name of Nicolas Cages son born on December 26, 1990?",Weston,Kal-El,David,Waren,Weston
"Nicolas Cage co-starred in a movie opposite his then-wife, Patricia Arquette.",True,False,True,,
"What was the name of the character, portrayed by Nicolas cage in The Rock?",Stanley Goodspeed,Stanley Goodheart,Stanley Godspeed,Stanley Goodspeed,Stanley Godsent
What was the name Nicolas Cages character in City Of Angels?,Seth,Gabriel,Michael,Messenger,Seth
"I was born February 28, 1961 in Edmonton, Alberta. My father is Chinese and Scotch-Irish while my mother is African American and Cherokee. My 2nd husband was actor C. Thomas Howell and we divorced in 1990.  Who am I?",Rae Dawn Chong,Rosario Dawson,Tonya Pinkins,Demi Moore,Rae Dawn Chong
"I was born in 1956 on the island of Cuba and my family immigrated to the United States in 1961. Some of my co-stars on the big screen have been Meg Ryan, George Clooney and Ray Liotta. Who am I?",Andy Garcia,Benicio Del Toro,Andy Garcia,Freddie Prince Jr.,Antonio Banderas
"I was born in April of 1900 and died just 17 days after the filming of my last movie was completed. Some of my co-stars included Katharine Hepburn, Elizabeth Taylor, Mickey Rooney and Gene Kelly. Who am I?",Spencer Tracy,Paul Harvey,Humphrey Bogart,Spencer Tracy,Maury Povich
I was born in 1976 and got my first break in a movie called The Man in The Moon in 1991. Who am I?,Reese Witherspoon,Blu Cantrell,Reese Witherspoon,Keri Russell,Naomi Watts
Who are Hilarys Parents?,Bob and Susan,Bill and Susan,Bill and Sally,Bob and Susan,Bob nad Sally
Hilary Duffs real hair color is blonde,False,False,True,,
Success came to Hilary Duff as she took the role of the starring title character in this  #1 Disney Channel Hit Series.,Lizzie McGuire,7th Heaven,One Tree Hill,Lizzie McGuire,Even Stevens
"Was Joel Madden, lead singer for Good Charlotte ever Hilary Duffs boyfriend?",Yes,Yes,No,,
Which of the following movies did Hilary Duff not play in?,Undiscovered,The Perfect Man,Undiscovered,Raise Your Voice,The Lizzie McGuire Movie
Hilary Duff has done charity work for Kids With a Cause.,True,False,True,,
In 2005 Hilary Duff starred in a sequel to which 2003 movie of hers?,Cheaper by the Dozen,The Perfect Man,Raise Your Voice,The Lizzie McGuuire Movie,Cheaper by the Dozen
Which one of these movies did Zac Efron star in?,High School Musical,Mean Girls,High School Musical,Take the Lead,Step Up
Lindsay Lohan starred in Mean Girls.,True,False,True,,
"Which one of these stars appeared in all of the following movies: Hide and Seek, Dreamer, Nine Lives, The Cat in the Hat, and Uptown Girls?",Dakota Fanning,Dakota Fanning,Vanessa Ann Hudgens,Lindsay Lohan,Brittany Murphy
In which of these films did Hilary Duff star?,All of the Above,Cheaper by the Dozen,All of the Above,Raise your Voice,Material Girls
Which of the following songs was performed by Paris Hilton?,Stars Are Blind,Men Are a Bind,Men Are Blind,Stars Are Blind,Stars Go Blue
"Who sang the song Come Back to Me, released in 2006?",Vanessa Anne Hudgens,Paris Hilton,Hilary Duff,Ashley Tisdale,Vanessa Anne Hudgens
Tinkerbell is the famous pet of which celebrity?,Paris Hilton,Lindsay Lohan,Hilary Duff,Fergie,Paris Hilton
Daniel Radcliffe is the star of what popular movie(s)?,Harry Potter,Lord of the Rings,Pirates of the Caribbean,Harry Potter,The Hobbit
Will Smith starred in the sitcom The Fresh Prince of Bel Air.,True,True,False,,
"What fantasy/adventure movie, starring Edward Speleers, was released in December 2006?",Eragon,Eragon,Dragon boy,Jurassic Park 4,Quest for Camelot
"Max Born, a German mathematician and physicist who won a Nobel Prize in 1954, was the grandfather of  what pop vocalist?",Olivia Newton-John,Cyndi Lauper,Billy Joel,Jimmy Buffet,Olivia Newton-John
TV actor and director Anson Potsie Williams is the nephew of this medical doctor who developed a procedure for drowning rescue and for treating asthma.,Henry Heimlich,Jack Kevorkian,Benjamin Spock,Henry Heimlich,C. Everett Koop
"D. H. Lawrence, the British author  of  Sons and Lovers,  was married to Frieda Weekley whose cousin gained fame for his heroism during World War I. What was his name?",Red Baron von Richthofen,Ernest Hemingway,Alvin York,Winthrop Roosevelt,Red Baron von Richthofen
"Her grandfather Frank was not only a high-ranking amateur tennis player who made it to the finals of Wimbledon, but he also co-starred with Mickey Rooney in a 1937 movie.",Brooke Shields,Brooke Astor,Brooke Shields,Brooke Adams,Brooke Smith
"In 1964, when this celebrity was just a 6-year-old boy, his famous father appeared on the cover of Time magazine because of his renown as a city  planner.",Kevin Bacon,Kevin Kline,Kevin Rooney,Kevin Smith,Kevin Bacon
"Oscar-winning screenwriter Budd Schulberg, who penned both On the Waterfront  and A Face in the Crowd, is the son of B.P. Schulberg, who ran which Hollywood studio during the 1930s?",Paramount Pictures,Warner Brothers,Columbia Pictures,Paramount Pictures,RKO
This American filmmaker was well poised to lampoon British characters since his own father Baron Saling of Essex was a British royal.,Christopher Guest,Harold Lloyd,Christopher Guest,Charlie Chaplin,Christopher  Lloyd
"This darling of the American TV sitcom world, famous for her role in Seinfeld, is unlikely to have pursued success purely for monetary reasons, since her father was reported to be a billionaire.",Julia Louis-Dreyfus,Jeanna Elfman,Julia Louis-Dreyfus,Barbara Eden,Audrey Meadows
Name the American TV and movie comedy star whose father was a prominent New York book editor and whose mother was descended from the Crane plumbing-fixture family.,Chevy Chase,Chevy Chase,Goldie Hawn,Gilda Radner,Dan Ackroyd
"After hitting 58 home runs for the Detroit Tigers in 1938, slugger Hank Greenberg made a huge hit with a major department-store owner in 1946 when he married his daughter, Caral. What was the name of the department-store chain?",Gimbels,Macys,Filenes,Wal-Mart,Gimbels
Stiller played a record company owner  named Jay Rose . Can you name this Ben Stiller movie?,The Suburbans,The Suburbans,Pauly Shore Is Dead,Run Ronnie Run,The Independent
Which one of these friendly actresses once held a job as a telemarketer?,Jennifer Aniston,Lisa Kudrow,Jennifer Aniston,Courtney Cox - Arquette,Maggie Wheeler
"Which of these occupations did Caryn Elaine Johnson fill, prior to becoming famous as the ubiquitous Whoopi Goldberg?",All of these,Funeral Parlor Employee,"Actress in short lived TV series, entitled Baghdad Cafe.",All of these,Brick Mason
"Which famous actor got fired from his job as a waiter in a restaurant, after consuming 6 steaks in one night for his dinner?",Dustin Hoffman,Tom Hanks,Jon Voight,Clint Eastwood,Dustin Hoffman
"Which of the following actors is also a lawyer, and was once a U.S. Senator?",Fred Thompson,Martin Sheen,Martin Short,Fred Thompson,Ronald Reagan
"Prior to becoming a well known actress,  what was one of the ways Camryn Mannheim, of  The Practice  earned a living?",As a Babysitter,As a Meter Maid,As a Food Technician,As a Landscape Designer,As a Babysitter
"You need a home Exterminator, so you call a service, and a guy shows up to do the job.  What famous actor do you suppose was in your basement, hunting up pests and rodents?",Warren Beatty,Tom Cruise,Russell Crowe,Gene Hackman,Warren Beatty
Actress Calista Flockhart once worked as an Aerobics Instructor.,True,True,False,,
"Which famous actor once considered a career as a Roman Catholic priest, prior to following the acting muse?",Tom Cruise,Ice T,Daniel Day - Lewis,Kiefer Sutherland,Tom Cruise
"What job did Madonna hold, soon after her arrival in New York City?",Cashier at Dunkin Donuts,Cashier at Dunkin Donuts,Transit Worker,Theater Usher,Bookkeeper
Tom adopted Isabella and Connor while married to this actress.,Nicole Kidman,Nicole Kidman,Penélope Cruz,Katie Holmes,Mimi Rogers
This is where Tom proposed to Katie Holmes in June 2005.,The Eiffel Tower,The Chinese Wall,The Eiffel Tower,Empire State Building,Bali
"In this 1986  movie Tom Cruise performed all his billiards shots except one, where he had to jump two balls to sink another. The director wanted him to learn this trick but it would have taken a couple of days, thus costing thousands of dollars extra.",The Color of Money,The Color of Money,Far and Away,Mission: Impossible,Collateral
This is the number of schools he attended while a  teenager.,15,15,25,20,10
"This is Tom Cruises film with the greatest number of errors, 109.",Top Gun,Top Gun,Vanilla Sky,Eyes Wide Shut,Mission: Impossible
"The original title of this movie was a translation of its Spanish version, namely Open Your Eyes. The director, Cameron Crowe, wanted to give this films name to another movie of his - Almost Famous.",Vanilla Sky,Jerry Maguire,Cocktail,Days of Thunder,Vanilla Sky
In this movie a real sword was used as the fake one broke in the sequence. In one scene the sword came within an inch of Toms neck.,The Last Samurai,The Last Samurai,Jerry Maguire,Far and Away,Risky Business
Tom caused a big stir among the medical society when he declared that his dyslexia was cured with the help of this new religion.,Scientology,Buddhism,Scientology,Shintoism,Kabbalah
"In 1996, he became the first actor in history to star in five consecutive films that grossed $100 million in USA.  The films were A Few Good Men (1992), The Firm (1993), Interview with the Vampire (1994), Mission: Impossible (1996) and this 1996 movie.",Jerry Maguire,Born on the Fourth of July,Eyes Wide Shut,Vanilla Sky,Jerry Maguire
"Arnold Alois Schwarzenegger was born in Thal, Austria on 30 July in the same year Carlos Santana was born. Which year?",1947,1960,1957,1945,1947
"The parents of Arnold - Gustav Schwarzenegger and Aurelia Jadrny, were persecuted by the Nazi party.",False,False,True,,
"Schwarzenegger first became famous as a bodybuilder. He won the titles of Junior Mr. Europe, Mr. World, IFBB Mr. Universe, NABBA Mr. Universe (four times), and Mr. Olympia (seven times). What was the moniker that he earned?",The Austrian Oak,The Aryan Oak,The Winner,The European Bull,The Austrian Oak
"In 1986, Arnold Schwarzenegger married the actress Brigitte Nielsen.",False,True,False,,
"Arnold Schwarzenegger worked in the United Kingdom for a while, before he moved to the US in this year. He had only $20 in his pocket and could not speak English very well.",1968,1968,1975,1960,1983
The fact that Arnold Schwarzenegger used anabolic steroids is well-known. He admitted and clarified that he used them for this purpose.,Muscle maintenance,Muscle maintenance,Losing weight,Muscle growth,Curing his heart problems
"After a long career as a professional bodybuilder, Arnold began to pursue a career as an actor. His first movie appearance was in Conan the Barbarian.",False,False,True,,
"Arnold Schwarzenegger and Danny De Vito played together in this movie. Their characters were brothers, raised separately at different locations, not knowing about each other.",Twins (1988),Red Heat (1988),Twins (1988),The Running Man (1987),Junior (1994)
"Schwarzenegger has been a Republican ever since he came to the US. In 2003 he became the Governor of California, serving the remainder of this mans term.",Gray Davis,Peter Pilz,Gray Davis,Pete Wilson,Cruz Bustamante
"In 1992, Arnold Schwarzenegger became the first owner of a Hummer vehicle manufactured for civilian use (this is true). The original Hummer was so large, that it was classified as a large truck.",True,False,True,,
When was actor Tom Hanks born?,"July 9, 1956","June 14, 1948","July 9, 1956","December 8, 1951","August 4, 1960"
Where was Tom Hanks born?,"Concord, California USA","Toronto, Canada","Kiev, Ukraine","Sacramento, California USA","Concord, California USA"
What city did Tom Hanks move to in 1978?,"New York City, New York","Boston, Massachusetts","New York City, New York","Minneapolis, Minnesota","Seattle, Washington"
What real life detective did Tom Hanks portray in the 2002 film Catch Me If You Can?,Carl Hanratty,Carl Hanratty,Frank Bignale Sr.,Jack Barnes,Roger Strong
"In the movie Forrest Gump, how many presidents does Forrest meet?",3,4,3,1,5
In which of these movie pairs did Gart Sinise co-star with Tom Hanks?,Forrest Gump and Apollo 13,Forrest Gump and Apollo 13,Philadelphia and Big,Apollo 13 and Splash,Big and Forrest Gump
When did Tom Hanks win back-to-back Academy Awards for best actor?,1993 and 1994,1993 and 1994,1994 and 1995,1992 and 1993,1990 and 1991
Who was Tom Hanks running partner for The Bad Haircut Party?,Conan OBrien,Conan OBrien,David Letterman,Craig Ferguson,Jay Leno
How is actor Tom Hanks probably related to Abraham Lincoln?,"third cousin, four times removed","third cousin, four times removed","cousin, twice removed",great nephew,great great grandson
Who did Tom Hanks portray in the 1995 film Apollo 13?,Jim Lovell,Gene Kranz,Buzz Aldrin,Jim Lovell,Pete Conrad
"American comedian, actor and writer, Steve Martin was born in Waco, Texas in what year?",1945,1935,1945,1947,1955
Actor and comedian Steve Martin attended which two educational institutions?,"Santa Ana College and California State University, Long Beach","Santa Ana College and California State University, Long Beach",Santa Ana College and UCLA,USC and Santa Ana College,Santa Ana College and USC
"In 1969, Steve Martin received an Emmy Award in what category?",Writing,Best Supporting Actor in a Comedy Special,Best Supporting Actor in a Comedy Series,Producing,Writing
"Steve Martins film debut, in the short movie The Absent-Minded Waiter was in what year?",1977,1987,1967,1980,1977
"In 1979, Steve Martin wrote and starred in his first full-length movie, named what?",The Jerk,Bringing Down the House,The Spanish Prisoner,The Jerk,Shopgirl
"Steve Martin made his first appearance on The Tonight Show, hosted by Johny Carson, in what year?",1972,1972,1970,1968,1971
"This album, which in 1977 won the Grammy Award for Best Comedy Album, was Steve Martins first.",Lets Get Small,Lets Get Small,Introducing Steve Martin,A Wild and Crazy Guy,Excuse Me!
This 1986 comedy western file was written by Steve Martin and Lorne Michaels.,Three Amigos!,The Jerk,Dead Men Dont Wear Plaid,Three Amigos!,All of Me
"This 1991 movie, directed by Mick Jackson, tells the story of weatherman Harris K. Telemacher, portrayed by Steve Martin.",L.A. Story,L.A. Story,Grand Canyon,Pennies From Heaven,The Out of Towners
"This play, set on October 8, 1904, was written by Steve Martin in 1994.",Picasso at the Lapin Agile,Picasso at the Lapin Agile,The Tempest,The Sleeping Prince,Saved
Jack Nicholsons first academy award nomination came for portraying a southern lawyer in the film Easy Rider.,True,True,False,,
Jack Nicholson holds the record for number of acting academy award nominations received in the history of cinema.,False,False,True,,
Which actress did not appear with Jack Nicholson in the film The Witches of Eastwick?,Jessica Lange,Michelle Phiffer,Jessica Lange,Susan Sarandon,Cher
Which of the following is not an academy award winning character portrayed by Jack Nicholson?,Jack Torrance,Melvin Udall,Garrett Breedlove,Randle P. McMurphy,Jack Torrance
What kind of character did Jack Nicholson portray in the movie Terms of Endearment?,A retired astronaut,A fired C.E.O. of an Electronics company,A retired astronaut,A fired cattle rancher,A retired banker
"In the film The Last Detail Jack Nicholsons character works in the oil fields, but is really an accomplished pianist.",False,True,False,,
"With 3 of Jack Nicholson Oscar wins, his female costar in the respective movie has also won an Oscar.",True,False,True,,
Which of these performers has Jack Nicholson not appeared in a movie with?,Paul Newman,Marlon Brando,Barbara Streisand,Robert DeNiro,Paul Newman
You cant handle the truth. is a famous Jack Nicholson quote from what movie?,A Few Good Men,A Few Good Men,The Last Detail,Ironweed,The King of Marvin Gardens
Which of these movies did Jack Nicholson not appear in?,The Score,Broadcast News,The Score,The Fortune,Tommy
Where does he get all those wonderful toys? is a quote from what Jack Nicholson film?,Batman,Anger Management,The Shinning,Batman,The King of Marvin Gardens
"In The Raven, Jack Nicholson gets to perform with Boris Karloff and Vincent Price, and Peter Lorre.",True,True,False,,
What 1958 movie marked Jack Nicholsons debut as an actor?,The Cry Baby Killer,Little Shop of Horrors,Psych Out,The Shooting,The Cry Baby Killer
"On July 2nd 1986, Lindsay Morgan Lohan was born to  Dina and Michael Lohan in New York City, New York. She was then raised in this town.","Cold Spring Harbor, New York","Saginaw City, Michigan","Elbridge, New York","Newburgh, New York","Cold Spring Harbor, New York"
"Lindsay began her career at this age, as a model of Ford Academy. Finding work as a child model was rather difficult at first, because her auburn hair and freckled face werent very popular.",3,2,3,5,4
"In a 2004 movie, Lindsay Lohan played a girl who lived in Africa for her first 15 years. Suddenly, she has to learn what high school in the U.S. means and how to survive it (this is true). The movie was a Disney production.",False,False,True,,
"In this non-musical MTV show, a practical joke was played on Lindsay Lohan- the show crew made her believe that a vehicle had been stolen. Can you remember the name of the show?",Punkd,Punkd,Boiling Point,Diary,Direct Effect
"Lindsay entered the world of pop music when she signed a five-album production deal with Emilio Estefan in 2002. In 2003, she performed this song for the Freaky Friday soundtrack.",Ultimate,Happy Together,Ultimate,I Wonder,Backstage
In 2004 Lindsay Lohan dated the actor Wilmer Valderrama.,True,False,True,,
"Lohan signed a recording contract with Casablanca Records in 2004, and her debut album was released on 7th of December of the same year.  What was the name of the album?",Speak,Speak,Over,First,Rumors
Lindsay Lohan has played in one of the movies in the Herbie series- Herbie: Fully Loaded. What was the name of her character in the movie?,Maggie Peyton,Charisma,Maggie Peyton,Sally,Mary Elizabeth Cep/Lola
"Lindsay is involved in many charity organisations and projects, such as The Carol M. Baldwin Breast Cancer Foundation, Save the Children and The United Cerebral Palsy Association. She also has her own charity organisation, called this.",Dream Come True,Dream Come True,For The Children,Abolish Slavery - Soon,Distressed Celebrities
"Lindsay has three younger siblings- Michael, Dakota and this girl.",Aliana,Aliana,Kate,Dina,Allison
"They called her this, because her body shape bears resemblance to it.",La Guitarra,La Guitarra,The Pear,Coca Cola,La Piovra
She started taking dancing and singing lessons at this age.,5,12,2,5,15
Before becoming a star Jennifer did work with this celebrity.,Janet Jackson,Latoya Jackson,Madonna,Janet Jackson,Aretha Franklyn
For her part in Selena Jennifer was paid this sum.,$1 million,$1 million,$2 million,$3 million,$4 million
Jennifer Lopez was born there.,"Bronx, New York","Bronx, New York","Rio De Janeiro, Brazil","Mexico City, Mexico","Los Angeles, California"
This is the name of Jennifers own line of perfume.,Glow,Sparkle,Flash,Twinkle,Glow
She does not drink this.,Alcohol,Soda pop,Coca Cola,Alcohol,Natural juices
For her role in Gigli Jennifer won Razie for this.,Worst actress,Best kiss,Best actress,Worst actress,Best debut
Lopez attended this kind of high-school.,All-girl high school,Minorities-only high school,Catholic high school,Mixed high school,All-girl high school
In 2001 Jennifer Lopez was ranked this in FHMs 100 Sexiest Women list.,# 1,# 4,# 1,# 2,# 3
What is the name of Tom Hanks character in the movie The Green Mile?,Paul Edgecomb,Paul Edgecomb,Rick Gasko,Ray Petersen,Chuck Noland
What is the name of Tom Hanks character is the movie The Burbs?,Ray Petersen,Sam Baldwin,Ray Petersen,Allen Bauer,Joe Banks
What is the name of the character played by Tom Hanks in the movie Castaway?,Chuck Noland,Carl Hanratty,Jimmy Dugan,Chuck Noland,Paul Edgecomb
What is the name of Tom Hanks character in the movie Sleepless in Seattle?,Sam Baldwin,Walter Fielding Jr.,Sam Baldwin,Allen Bauer,Rick Gasko
What is the name of the character portrayed by Tom Hanks in the movie Splash?,Allen Bauer,Allen Bauer,Joe Banks,Rick Gasko,Walter Fielding Jr.
What is the name of Tom Hanks character in the movie A League of Their Own?,Jimmy Dugan,Carl Hanratty,Ray Petersen,Chuck Noland,Jimmy Dugan
What is the name of the character played by Tom Hanks in the movie Bachelor Party?,Rick Gasko,Allen Bauer,Paul Edgecomb,Sam Baldwin,Rick Gasko
What is the name of Tom Hanks character in the movie The Money Pit?,Walter Fielding Jr.,Joe Banks,Carl Hanratty,Sam Baldwin,Walter Fielding Jr.
What is the name of Tom Hanks character in the movie Catch Me If You Can?,Carl Hanratty,Allen Bauer,Carl Hanratty,Jimmy Dugan,Paul Edgecomb
What is the name of the character played by Tom Hanks in the movie Joe Versus the Volcano?,Joe Banks,Joe Banks,Walter Fielding Jr.,Allen Bauer,Sam Baldwin
Which American actress was banned from The Philippines in September 1998?,Claire Danes,Claire Danes,Kirsten Dunst,Maggie Gyllenhaal,Sarah Jessica Parker
Which actress played the younger sister in 1999s 10 Things I Hate About You?,Larisa  Oleynik,Gabrielle Union,Julia Stiles,Larisa  Oleynik,Michelle Williams
Which actress was the first choice for âRose from the 1997 hit âTitanic?,Claire Danes,Kate Winslet,Claire Danes,Cate Blanchett,Rose McGowan
In 1991 Sarah Jessica Parker appearred in âL.A.Story. Who was the male star of the movie?,Steve Martin,Woody Allen,Johnny Depp,Nicolas Cage,Steve Martin
Which of these actresses won an Oscar for portraying a male character?,Linda Hunt,Helen Hunt,Linda Hunt,Gwenyth Paltrow,Barbara Streisand
Which actress has had at least four songs written about her?,Claire Danes,Claire Danes,Rose McGowan,Kirsten Dunst,Rosana Arquette
Which of these actresses did not appear in the 2002 film Adaptation?,Kate Winslet,Meryl Streep,Kate Winslet,Judy Greer,Maggie Gyllenhaal
"Which of these actresses was born in Florence, Italy?",Rose McGowan,Angelica Huston,Rose McGowan,Cate Blanchett,Joan Cusack
Elizabeth Taylor campaigned hard for her new husband John Warner who became a senator from Virginia in 1978.,False,True,False,,
"Fireworks were expected when Madonna married this intense, actors actor. The dismal reception to their movie Shanghai Express couldnt have helped the marriage.",Sean Penn,Warren Beatty,Guy Ritchie,Sean Penn,Guy Pierce
This is Pariss nickname.,Princess,Princess,Model,Beauty,Queen
In 2001 Paris was engaged to him.,Jason Shaw,Rick Salomon,Jason Shaw,Leonardo DiCaprio,Baron Nicholas
Her popularity rose significantly after this appeared on the internet in 2003.,An explicit home-made video,A picture of Paris nude on the beach,A recording of Paris cursing,A recording of Paris singing in the bathroom,An explicit home-made video
This is Paris trademark quote.,Thats Hot,Stay Away,Love Me,Dont Hate Me Just Because Im Beautiful,Thats Hot
Fashion critic Mr. Blackwell chose her as such.,The worst-dressed celebrity,The best-dressed celebrity,The most stylish celebrity,The worst-dressed celebrity,The least stylish celebrity
This is the number of parties Paris Hilton threw for her 21st birthday.,5,5,8,3,2
This actress is a good friend of Paris Hilton.,Tara Reid,Tara Reid,Tyra Banks,Jenifer Aniston,Alicia Silverstone
Paris wears this color contact lenses.,Blue,Green,Blue,Grey,Brown
Paris has these kinds of dogs as pets.,Pomeranians and Chihuahuas,Pomeranians and Chihuahuas,Afghan Hounds and Basenjis,Chihuahuas and Chow Chows,Bearded Collies and Bulldogs
Paris Hilton is related to this star.,Zsa Zsa Gabor,Jackie Onassis,Gretta Garbo,Zsa Zsa Gabor,Rita Hayward
"The author of these words -- American actor, writer, and stand-up comedian, is known for his ironic, witty, and sometimes confusing jokes and lines.",Steven Wright,Gilbert Gottfried,Steven Wright,Paula Poundstone,George Carlin
"This great comedian, whose career spanned vaudeville, film, radio, and television, was especially popular for the team performances with his wife - the well-known comedienne Gracie Allen.",George Burns,George Burns,George Carlin,George Wallace,George  Cambridge
"Complete this popular line of comedian Ronnie Shakes: âAfter twelve years of therapy my psychiatrist said something that brought tears to my eyes. He said, _______. â",No hablo ingles.,No hablo ingles.,"Sorry, I wasnt listening for the last 12 years..",Repeti conmigo por favor!,Im giving up!
Which famous American comedian made this ironic statement about marriage?,Brian Kiley,Freddie Roman,Jim Gaffigan,Brian Kiley,George Tyler
"This famous one-liners author starred along Roberto Benigni in 2003s, Coffee and Cigarettes.",Steven Wright,Steven Wright,Louis Black,Emo Phillips,George Carlin
"Although this comedian initially considered becoming a lawyer, he eventually got into comedy.",Paul Rodriguez,George Lopez,Carlos Mencias,Tino Tavaras,Paul Rodriguez
Finish this old joke by famous comedian Steven Wright: I went to a restaurant with a sign that said they served breakfast at any time. So I ordered French toast ____,during the Renaissance,during the Stone Age,at 3 a.m. in the morning,during the Renaissance,for tomorrow morning
"A grandmother is watching her grandchild playing on the beach when a huge wave comes and takes him out to sea. She pleads, please God, save my only grandson. I beg of you, bring him back. And a big wave comes and washes the boy back onto the beach, good as new. She looks up to heaven and says: He had a hat! ",Myron Cohen,Myron Cohen,Don Adams,Jackie Mason,Henny  Youngman
"This English-born American comedian, who was also a violinist, is well known for his âone-liners, which were short and simple but at the same time very effective.",Henny Youngman,George Burns,Henny Youngman,Myron Cohen,Jerry Seinfeld
