question,answer,A,B,C,D
Cairo means happiness in Arabic.,False,True,False,,
What place in New York was named Vlissigen by the Dutch?,Flushing,Yonkers,Brooklyn,Flushing,Harlem
Omaha is a distorted Native American tribal name.,True,True,False,,
What does Sahara mean in Arabic?,wasteland,oasis,fertile,wasteland,sand
For which monarch was the state of Virginia named?,Queen Elizabeth I of England,King Louis IV of France,King Virgil of Denmark,Mary Queen of Scots,Queen Elizabeth I of England
Which one of these words means an ornamental clasp or pin?,brooch,brocade,ballast,bivouac,brooch
Pick the B word that does NOT mean to nag or intimidate.,befuddle,bluster,befuddle,badger,browbeat
Which one of these words means to soil or defile?,besmirch,besmirch,bewitch,broach,beseech
Which of the following words does NOT mean a blessing?,blight,benediction,benevolence,blight,boon
What does the word blithe mean?,joyous and lighthearted,joyous and lighthearted,full of errors,"limber, spry, agile",hard to understand
Choose the B word that means rough or noisy.,boisterous,bawdy,boisterous,boorish,bland
Which of these word means a large group?,bevy,bugaboo,bastion,bevy,blandishment
Which of these B words means shortness of duration?,brevity,blasphemy,bureaucracy,brevity,buffoonery
Which one of these words means cheerful and optimistic?,buoyant,buoyant,bacchanalian,bereft,bucolic
Which of these words means highly ornate?,baroque,baroque,bombastic,blase,burnishing
Is it true that the figures of Cupid throughout history have had two different sides?,Yes,Yes,No,,
There are several different stories about Cupids parentage and the most popular is that his mother is Venus and his father - Mars.,True,True,False,,
The typical Christian depiction of a cherub is often compared to Cupid.,True,False,True,,
Cupid appears in the movie Toothless and is portrayed by actor Richard Chamberlain.,False,True,False,,
"According to Greek mythology, this god is responsible for lust, love and sex.",Eros,Eros,Cupid,Mars,Kama
"In ancient Athens, one day per week was sacred to Eros.",False,False,True,,
"February 14 is the day set aside for Valentines Day, the day celebrating love.",True,False,True,,
100 million valentines are estimated to be given out in February in honor of Valentines Day.,False,False,True,,
What kind of creature is the leprechaun in Irish mythology?,Fairy,Fairy,Gnome,Dwarf,Demon
"Which popular NBA team has a logo, featuring a leprechaun?",Boston Celtics,Washington Wizards,L.A. Lakers,Boston Celtics,Orlando Magic
Once leprechauns were described as creatures dressed in red.,True,False,True,,
What is the traditional craft practiced by leprechauns according to Irish mythology?,making shoes,making shoes,making shamrocks,making hats,making gold coins
"According to legend, a leprechaun must tell the truth if looked directly in the eye.",True,True,False,,
"In the old days, in order to keep leprechauns content, Irish people used to leave out a dish of what?",Milk,Milk,Beer,Whiskey,Cookies
There are female leprechauns.,False,True,False,,
A quorum has to do with a group of  which of these?,people,flowers,words,animals,people
Which of these words is associated with clothing?,raiment,raison detre,raiment,recherche,rugger
Pick out the word that means a type of person.,sybarite,sylvan,sybarite,stentorian,sternum
Tellurium is a metallic element of this color combination.,silvery/white,black/white,silvery/white,red/white,gold/white
The word umbilicus refers to what part of the human body?,the navel,the legs,the eye brows,the head,the navel
Which of these words means having an insatiable appetite?,voracious,vole,viviparous,vizier,voracious
Which of these animals can be a wrasse?,fish,goat,antelope,pig,fish
Pick out the name of the king of Persia from either 519-465 B.C. or 486-465 B.C.?,Xerxes,Xenon,Xebec,Xerxes,X-axis
The word yurt is similar in meaning to which of these words?,tent,a medieval creature,ship,statue,tent
Zoroastrianism refers to which of the following?,a type of religion,,a type of religion,human sacrifice,Greek philosophy
Which of these words means to guess?,conjecture,conjecture,castigate,contrive,coerce
Does the word clemency mean the state of being a huge Mark Twain fan?,No,Yes,No,,
Pick the word that does NOT mean conversation.,concordance,colloquy,chitchat,concordance,conference
Which of these words can be defined as an expert critical judge of art?,connoisseur,coquette,connoisseur,clairvoyant,charlatan
Which one of these words means pleased or satisfied with oneself?,complacent,capacious,complacent,congenial,candid
Which of these words means panic?,consternation,cynicism,cataclysm,cacophony,consternation
Pick the word that means annoyance at ones own failures or errors.,chagrin,cupidity,collusion,chagrin,composure
Which one of these words means to recover after a sickness?,convalesce,cauterize,convalesce,coddle,conciliate
The word centimeter means one hundred meters.,False,False,True,,
Find the word that does NOT mean to hold back.,conduce,check,constrain,control,conduce
For which culture does a Sinophile have an obsessive love?,China,France,China,Japan,England
Philhellenism is an obsessive love of which culture?,Greek,Chinese,Japanese,Greek,German
What is cyberphilia?,An obsessive love of the Internet,An obsessive love of the Internet,An obsessive love of flowers,An obsessive love of cybersex,An obsessive love of electronics
This is an obsessive love of  clowns.,Coulrophilia,Cacophilia,Bathyhilia,Coulrophilia,Bufonophilia
Of course there is a word for an obsessive love of peanut butter sticking to the roof of your mouth. Which one is it?,Arachibutyrophilia,Bibilophilia,Arithmophilia,Arachibutyrophilia,Canophilia
This is an obsessive love of walking.,Ambulophilia,Tocophilia,Pedalophilia,Ambulophilia,Sesquipedalophilia
For what does a lygophile have an obsessive love?,Darkness,Wine,Old people,Darkness,Kindness
This is an obsessive love of cats.,Ailurophilia,Phallainophilia,Catagelophilia,Apiophilia,Ailurophilia
Trichophilia is an obsessive love of what ?,Hair,The dark,Pain,Hair,Insects
What do we call an obsessive love of being ridiculed?,Catagelophilia,Enochlophilia,Agathophilia,Catagelophilia,Drosophilia
What is the term for obsessive love of wild animals?,Agriozoophilia,Agriozoophilia,Pogophilia,Zoaphilia,Atelophilia
What is  cenophilia ?,An obsessive love of empty spaces,An obsessive love of being dirty,An obsessive love of empty spaces,An obsessive love of animal fur skins,An obsessive love of school
Which of these phrases can mean fashionable?,a la mode,a propos,a la carte,a gogo,a la mode
"Literally (not figuratively), what does the word adieu mean?",to God,to God,farewell,what,hello
What is an aperitif?,a before meal drink,a terrific person,a before meal drink,an opening,a guess
What does blase mean?,unimpressed,blazer,unimpressed,tired,bleak
Cafe au lait is an outdoor cafe.,False,True,False,,
What does the word coquette mean?,a flirtatious girl,a flirtatious girl,a fancy hair style,a salmon patty,a type of poodle
Which phrase refers to love of life?,joie de vivre,joie de livre,joie de vivre,joie dadore,joie de cafe
"The definition of the phrase, cause celebre, is an issue arousing widespread controversy or heated public debate.",True,True,False,,
What is the literal translation of vis-a-vis?,face to face,face to face,I see you,up front,in regards to
Which phrase can mean feat of strength?,tour de force,soup du jour,tete a tete,tour de suite,tour de force
Suppose you wanted to study law and become a lawyer.   The word for lawyer in Spanish is _______________.,abogado,peluquero,abogado,conductor,cocinero
"In Spanish, what would you be called if you were a fireman?",bombero,ebanista,banquero,botanico,bombero
What if you wanted to be the mayor of your town?   What would that profession be called in Spanish?,alcalde,clerigo,tabernero,alcalde,carnicero
"How about if you become a baker?  In Spanish, you would be called a what?",panadero,panadero,carpintero,marinero,cerrajero
Youre 5 years old.   Your mommy asks you what you want to be when you grow up.  You say I wanna be a cowboy.  How would you say cowboy in Spanish?,vaquero,contador,escultor,vaquero,taquillero
"My dad is an avid fisherman.  If he were a Spanish fisherman, what would his profession be called?",pescador,florista,cartero,pescador,artesano
"If you wanted to be a clown in a Spanish circus, you would be called a payaso.",True,True,False,,
Your father was a cobbler. Your grandfather was a cobbler. Your great grandfather was a cobbler.  Chances are you may become a cobbler too.  What would the Spanish word for cobbler be?,zapatero,criado,zapatero,jardinero,camarero
"Okay, so you want to be a judge in Madrid.  What word would you be called?",juez,juez,plomero,cambiadiscos,borracho
My brother lives in Mexico City.  He wants to be a trainer.  What would his job be called in Spanish?,entrenador,enfermero,droguero,entrenador,fraile
What is the English word for the Spanish word fiesta ?,party,three,nap,fire,party
How do you translate the Spanish word pescado into English?,fish,mosquito,fish,pessimism,fire alarm
What is the English word for the Spanish paloma?,pigeon,friend,sheep,wind,pigeon
The English word for the Spanish word corazÃ³n is what?,heart,corridor,complaint,heart,candle
Give me the English word for the Spanish word hermano.,brother,herring,hermit,golf course,brother
How does one say the word naranja from Spanish into English?,orange,black,orange,green,purple
Now give me the English word for the Spanish word espejo.,mirror,mirror,perjury,horse,special
Give me the English variant for the Spanish first name Guillermo.,William,George,Joshua,James,William
What is the translation of the Spanish word miÃ©rcoles in English?,Wednesday,Wednesday,Saturday,Friday,Monday
How do you translate cuchara from Spanish to English?,spoon,spoon,knife,fork,plate
What is a Tombola?,A type of lottery,A type of lottery,A bone of the inner ear,A male cricketer,A musical instrument
Tomentum is a word describing the increase in speed of a rolling object which is then accelerated e.g. kicking a soccer ball,False,True,False,,
What is another word for tome?,work,sound,pass,work,trumpet
Which Tom played Dr Who in the cult BBC television series?,Tom Baker,Tom Baker,Tom Stoppard,Tom Archer,Tom Collins
Which musician(s) created the rock opera Tommy?,The Who,The Rolling Stones,Elton John,The Beatles,The Who
"A Tom Collins is a long drink consisting of vodka, lime or lemon juice, sugar and soda water.",False,False,True,,
"In Greek mythology, Sirens often led sailors to their deaths with their beautiful songs.",True,False,True,,
"In Greek mythology, a minotaur was made up of what two creatures?",man and bull,man and horse,man and woman,man and bull,man and lion
This 3-headed beast guarded the gates to Hades.,Cerberus,Hydra,Sphinx,Cerberus,Zylon
How do we call a person who initiates an attack?,aggressor,aggressor,tailor,scarfor,administrator
This is how we refer to a person who writes any type of literary products.,author,creator,director,educator,author
What is the term for a person responsible for devising a new machine or a new process of doing something?,inventor,administrator,author,mentor,inventor
How do we call a person who takes on a new identity in order to deceive?,impostor,impostor,aggressor,perceptor,deceptor
"Someone who entertains by pretending to be someone else, usually either in a play or through film products.",actor,actor,spectator,director,creator
A university or college teacher is known as a professor.,True,True,False,,
How do we call someone that does detective work?,investigator,investigator,instigator,supervisor,impostor
A tailor is someone who only makes new clothes.,False,True,False,,
A spectator is someone who participates in activities or sporting events.,False,True,False,,
Which of these terms are used for a person who is responsible for or oversees the work done by others?,all of these,administrator,supervisor,director,all of these
"This god, representing everything that threatened harmony in Egypt, was the brother of Osiris and Isis. He murdered Osiris, then battled with his nephew Horus to be the ruler of the living.",Seth,Sobek,Seth,Shu,Thoth
"Since jackals were often seen in cemeteries, the ancient Egyptians believed that Anubis, a god with human body and jackal head, watched over the process of embalming.",True,True,False,,
"Tawaret was a goddess who protected women during pregnancy and childbirth. She was most often depicted with the head of a hippopotamus, arms and legs of a lion, back and tail of a crocodile, and breasts and stomach of a pregnant woman.",True,True,False,,
The goddess Anekantin was Isisâ sister and Anubisâ wife.,False,True,False,,
This center is associated with intuition and sensory perception.,Center of brow,Center of brow,Heart,Mid-back,Base of spine
Location of the spiritual center.,Throat,Crown,Back,Spine,Throat
What color would you use to heal the etheric (root) center?,Red,Blue,Green,Red,Yellow
What color would we nedd to heal the soul?,Violet,Yellow,Green,Orange,Violet
"The hara, located approximately three inches below the navel, also know as this chakra.",Orange,Orange,Green,Indigo,Pink
"The heart center located at the center of the chest is this color and controls the circulatory system, heart, lungs and entire chest area.",Emerald Green,Blue,Emerald Green,Brown,Yellow
The brow center is associated with a persons extra-sensory perception and inner vision.  It is represented by this color.,Indigo,Green,Indigo,Amber,Pink
"This color is used to heal the solar-plexus, also known as the power center.",Yellow,Red,Pink,Yellow,Violet
How many major chakras are there?,7,7,9,8,6
Chakras are centers for this intangible quality.,Energy,Emotion,Soul,Energy,Spirit
Which German word means knowledge in English?,Kenntniss,Kuchen,Kenntniss,Trinken,Antwort
The German noun Frage means question in English.,True,False,True,,
How is the German word Arztin translated into English?,Doctor,Doctor,Kitchen,Art show,Bathroom
What is the English equivalent of the German phrase Woher kommen Sie?,Where do you come from?,Where is that?,Where do you come from?,What is that?,What did she say?
"German and English have a lot in common, because they both belong to the group of Germanic languages. How is the question Wie alt sind Sie? translated into English?",How old are you?,Where do you live?,How do you get there?,How do you do?,How old are you?
What is the word for table in French?,table,table,escritoire,chaise,armoire
How do you say cat in French?,chat,oiseau,chat,chien,cheval
"If I wanted to say the word pencil in French, what would I say?",crayon,craie,gomme,stylo,crayon
"Count to five in French: un, deux, trois, quatre, ____. What is the missing number?",cinq,huit,dix,cinq,cinquante
What is the French word for snow?,neige,pluie,soleil,neige,vent
Which of these is the French word for peace?,paix,confiance,bonheur,paix,amour
What is the word for egg in French?,oeuf,oeuf,quiche,jambon,crÃªpe
How does one say cup in French?,tasse,fourchette,assiette,tasse,cuillÃ¨re
Youâre in France and you want to tell someone that he has a nice tie. What is the word for âtie?â,cravate,cravate,chaussette,chaussure,chapeau
What is the French word for sea?,mer,chÃ¢teau,montagne,maison,mer
Watch out! The road is under _____________.,Construction,Construction,Water,Pressure,Age
"What does the Latin phrase Quidquid latine dictum sit, altum videtur mean?",Anything said in Latin sounds profound,Latin is the mother of all languages,Every wise man should speak Latin,Anything said in Latin sounds profound,"You cannot see the truth, until you learn Latin"
What does Ad astra per aspera mean in English?,To the stars through hardships,Humankind aspires to reach the stars,One cannot reach a star,Rich people never smile,To the stars through hardships
"Julius Caesar once said veni, vidi, vici. What did he mean?","I came, I saw, I conquered",To win is to see yourself winning,A good enemy is a dead enemy,A friend in need is a friend indeed,"I came, I saw, I conquered"
What is vir in Latin?,A man,A man,A virus,A human,An enemy
What does Vae Victis mean?,Woe to the conquered,Glory to the winners,Woe to the conquered,"If you win, you loose",Beware of the conqueror
"If your business partner says pacta sunt servanda, what does he/she mean?",Agreements must be honoured.,Your business is finished.,Agreements must be honoured.,You are my slave now.,How can I serve you?
To whom can you say Cura te ipsum!?,"To a doctor, when you do not agree with his/her diagnosis",To a policeman who arrests you,"To your partner, expressing your love","To a beggar, when you dont have any money","To a doctor, when you do not agree with his/her diagnosis"
"When they refer to future events in writing, some people use DV which stands for Deo volente. What does it mean?",By Gods will,"While life is, hope is",God is (my) protector,God wills it,By Gods will
When is it proper to say Nunc est bibendum?,At a party,When you want to smoke,At a party,In court,At a catholic mass
"What does Roma locuta, causa finita est mean?","Rome has spoken, the discussion is finished.",Rome wasnt built in a day.,"Rome has spoken, the discussion is finished.","When in Rome, do as the Romans do.",All ways lead to Rome.
What is the meaning of sapiens?,"wise, reasonable",a mammal,"wise, reasonable",walking on two legs,human
How can Nemo sine vitio est be translated into English?,No one is without fault,No one is without fault,To sin is human,No-one is a judge in his own case,Fish dont have voice
What is the missing part of the proverb Hatred is as blind as ...?,Love,A mole,None of these,Love,Darkness
Finish the proverb: Blood is thicker than ...,Water,Sweat,Tears,Wine,Water
What is the missing word in the popular proverb A stitch in time saves ...?,Nine,Nine,Everybody,A dime,Thousands
Complete the popular proverb: Tall oaks grow from ...,Little acorns,Small saplings,Nutritious soil,Strong earth,Little acorns
"What is the missing part of the proverb, The ... wounds more than a lance?",Tongue,Evil eye,Tongue,Hand,Word
What is the end of the proverb Two wrongs dont make ...?,A right,It easier,The world a better place,A right,A fight
What is the missing part of the saying Make a silk purse out of a ...?,Sows ear,Cows ear,Silk dress,Sows ear,Woolen sock
What is the missing word of the proverb: A loaded ... makes no noise?,Wagon,Train,Wagon,Gun,Horse
What is the missing word from the popular saying A burnt child dreads the ...?,Fire,Stove,Fire,Air conditioner,Match
Complete the following proverb: Learn to walk before you ...,Run,Run,Crawl,Speak,Leap
"Which word refers to the ancient Greek songs, performed by a chorus in honor of the Greek god, Dionysus?",dithyramb,thriambos,dithyramb,thyrsus,tirsu
"Within the Olympian tradition, Dionysos was said to be the son of Zeus and which mortal woman?",Semele,Semele,Medea,Metis,Leda
In both Greek and Roman mythology Dionysus is known by what other name?,Bacchus,Bacchus,Ares,Cadmus,None of these
Which word refers to the ecstatic female worshippers of god Dionysos?,maenads,maenads,satyrs,herms,sileni
Dendrites is one of the epithets used for god Dionysus.,True,False,True,,
"God Dionysus is viewed as the promoter of civilization, a lawgiver, and lover of peace.",True,True,False,,
"Which word refers to the eating of raw flesh, a common practice in Dionysian worship?",omophagia,ekstasis,sparagmos,enthousiasmos,omophagia
"These mythological half-man and half-goat creatures, which roamed the woods and mountains, were companions of Dionysus.",satyrs,satyrs,centaurs,bacchaents,silenis
Worshippers of god Dionysus often wore what type of attire over their shoulders?,fawn skin,goat-skin,lions head,fawn skin,sheep-skin
"Anthesteria, a festival in honour of Dionysus, celebrated the maturing of the wine stored at the previous vintage, and the beginning of spring.",True,False,True,,
Which one of these goddesses is NOT similar to Aphrodite in some way?,Saraswati,Saraswati,Turan,Inanna,Ishtar
Was the lime tree goddess Aphrodites sacred tree?,Yes,No,Yes,,
Which one of these animals was NOT sacred for Aphrodite?,Peacock,Dolphin,Swan,Sparrow,Peacock
Which one of these names is not one of goddess Aphrodites surnames?,Telaia,Dionaea,Anandymene,Acraea,Telaia
"According to Greek mythology, who was Adonia?",The name of a festival to celebrate Adonis and Aphrodite,Adonis and Aphrodites daughter,Aphrodites servant,The name of a festival to celebrate Adonis and Aphrodite,Adonis and Aphrodites son
"Born in Barrow, Suffolk she studied to become one of the most important portrait painters in the 17th century.",Mary Beale,Antoinette Bouzonnet-Stella,Mary Beale,Lucrina Fetti,Artemesia Gentileschi
"In her twenties, this Dutch painter became the only female member of the Haarlem painters guild and quickly adopted students of her own.",Judith Leyster,Anne Killigrew,Judith Leyster,Giovanna Garzoni,Maria Sibylla Merian
She is the only Flemish woman to have specialized in still-life painting as early as the beginning of the 17th century.,Clara Peeters,Teresa Del Po,Maria Sibylla Merian,Louise Moillon,Clara Peeters
"She was arguably the most educated and most famous woman of the 17th century. She spoke Latin, modern European languages, Greek, Hebrew, Arabic, Syriac, Aramaic, and Ethiopian.  She also excelled in art, music and literature.",Anna Maria van Schurman,Luisa Ignacia Roldan,Rachel Ruysch,Anna Maria van Schurman,Teresa Del Po
"This Swiss Neoclassicist painter was chosen to paint the portrait of Monsignor Nevroni, bishop of Como, before she turned 12.  Later, she became a distinguished portrait painter.",Angelica Kauffmann,Elizabeth Blackwell,Angelica Kauffmann,Ann Bateman,Hester Bateman
"Born in London, she became the most important woman in the silver trade.  She and her husband made their reputation with silver in the popular French rococo style.",Louisa Courtauld,Louisa Courtauld,Amelia Farnborough,Mary Ann Croswell,Marie Nicole Dumont
This woman is referred to as the the most outstanding woman goldsmith of her generation . But this was not by chance - she was the daughter of the famous English silversmith Simon Pantin.,Elizabeth Godfrey,Angelica Kauffman,Elizabeth Godfrey,Rebecca Emes,Anne Seymour Damer
She was the predecessor of Madame Tussaud. She modelled wax figures of famous people.,Patience Wright,Luisa Roldan,Frances Scott,Patience Wright,Caroline Watson
"Although she was very young in 1876,  she had great success painting the portrait of Sarah Bernhardt.",Louise Abbema,Charlotte Bonaparte,Maria Bashkirtseff,Louise Abbema,Anna Bilinska
"The themes of this artist are feminist and political, depicting literary-historical figure groups and decorative female heads.",Marie Spartali Stillman,Marie Spartali Stillman,Suzanne Valadon,Annie Swynnerton,Lilly Martin Spencer
In Greek mythology the Cyclopes were the so called Olympians masons. They built the marvellous palace of the gods at the top of the highest mountain in Greece - Mount Olympus.,True,False,True,,
Why did Phaethon take Apollos chariot and ride off across the sky?,"He was taunted about his origin by Epaphus, a son of Zeus.",He wanted to take the place of his father Helios.,His mother Clymene drove him to take his fathers chariot.,He wanted to impress the Greek goddess Aphrodite because he was in love with her.,"He was taunted about his origin by Epaphus, a son of Zeus."
What was the name of the mythological statue in which Pygmalion fell in love and eventually the statue became a woman?,Galatea,Lachesis,Galatea,Echo,Leda
"What was the name of the Lithuanian god of the sky, earth, sea and all living creatures who decided to punish mankind and sent to the Earth the Spirit of water and the Spirit of wind?",Praamzius,Praamzius,Jurate,Patrimpas,Perkunas
"What was the name of the Lithuanian god that can be compared to the Creek god of underworld, Hades?",Pikulas,Saule,Pikulas,Menulis,Zemepatis
"According to Greek myths, this was the first robot which was made by Hephaestus to protect Crete.",Talos,Rhadamanthys,Talos,Sarpedon,Minos
In Finnish myths the Sampo was a magic artifact made by the blacksmith IImarinen for the sorceress Louhi of Pohjola. What kind of object was this artifact?,a mill,a medallion,a mill,a sword,a ring
"According to Scandinavian mythology, the chaos will defeat the guardians of good and this catastrophe will bring the world to an end. What is the name of this final battle between evil and good, in which the gods will be outnumbered?",Ragnarok,Heimdall,Ragnarok,Einherjar,Asgard
"This is the goddess of eternal youth, the guardian of the golden apples of youth in the Scandinavian mythology.",Idun,Volla,Idun,Freya,Bragi
"According to a Polish legend, which city in Poland was named after a hero who defeated a fearful dragon?",Cracow,Warsaw,Pornan,Torun,Cracow
What state in the U.S. is commonly believed to have Spanish as an official language?,New Mexico,New Mexico,Oregon,Nevada,Hawaii
In what country in Africa is Spanish the official language?,Equatorial Guinea,Libya,Angola,Nigeria,Equatorial Guinea
What language is regarded as the biggest contributor to the Spanish language after English and Latin?,Arabic,Persian,Turkish,Arabic,Hungarian
"Besides Espanol, Spanish language is also called Castellano.",True,True,False,,
"This language, spoken by the Sephardic Jews, is a combination of Hebrew and Spanish.",Ladino,Galician,Ladino,Basque,Catalan
Spanish is one of the six official languages of the U.N.,True,False,True,,
What is the name of the institution responsible for regulating the Spanish language?,Royal Spanish Academy,Department of Spanish,Royal Spanish Academy,Castillian association,Ministry of Spanish
