question,answer,A,B,C,D
Which vegetables are considered taboo food in Buddhist tradition?,Garlic and onion,All legumes,Garlic and onion,Eggplants and tomatoes,Cabbage and lettuce
Is this the correct usage of the word inferring? ,No,No,Yes,,
Is this the correct usage of the word continually? ,No,No,Yes,,
Which of these sentences is correct?,Whence did he come?,"From hence to eternity, I will search.",Whence did he come?,From whence did he come?,"If you build it, thence he will come."
Which of these is correct?,The capitol building is located in the capital.,The capitol building is located in the capitol.,The capital building is located in the capital.,The capitol building is located in the capital.,The capital building is located in the capitol.
"In the following sentence, which word is incorrect?  ",None of the words is incorrect; the sentence is correct as is.,principal,unprincipled,principle,None of the words is incorrect; the sentence is correct as is.
Which of the following is NOT a synonym of the word reticent?,These are all synonyms of the word reticent.,These are all synonyms of the word reticent.,Restrained,Silent,Reluctant
Which of the following is incorrect?,These are all correct usages of the word comprised.,The class comprised 30 people.,Thirty people comprised the class.,These are all correct usages of the word comprised.,The class was comprised of 30 people.
Which of these is incorrect?,All of these sentences are correct.,He woke up at six.,All of these sentences are correct.,He awoke at six.,He awakened at six.
Which of these sentences means I love you in Spanish?,Te amo.,Te amo.,Kocham cie.,Mi amas vin.,Ti amo.
Rakastan sinua is one of the ways to say I love you in which European language?,Finnish,Bulgarian,French,Finnish,German
Which expression would you use to say I love you in Danish?,Jeg elsker dig.,Jeg elsker dig.,Volim te.,I love thee.,Je taime.
In what European language does Je taime mean I love you?,French,Swedish,Italian,German,French
Which of the following sentences means I love you in German?,Ich liebe Dich.,Ich liebe Dich.,Te amo.,Volim te.,Je taime.
Volim te means I love you in three of these European languages. Which is the odd one?,Italian,Croatian,Bosnian,Italian,Serbian
What is the Swahili expression for I love you?,Nakupenda,Te quiero,Nakupenda,Ti amo,Je taime
In which Turkic language does Seni seviyorum mean I love you?,Turkish,Navajo,Hebrew,Icelandic,Turkish
"Name this artificially-constructed international language, in which Mi amas vin means I love you.",Esperanto,Thai,Navajo,Spanish,Esperanto
Which of these sentences means I love you in Dutch?,Ik hou van jou.,Ti amo.,Ik hou van jou.,Ne mohotatse.,Ich liebe Dich.
"The implement, used to extinguish the flame of a candle, is called this.",Candlesnuffer,Candleberry,Candleholder,Candlestick,Candlesnuffer
"When something contains or yields an acid, it is this.",Acidiferous,Acidiferous,Acidophilous,Acidimetric,Acidifiable
"The monitoring, recording, and measuring of a living organisms basic physiological functions is known as this.",Biotelemetry,Biomedicine,Bipartisanism,Biosystematy,Biotelemetry
Enterokinase is this.,Enzyme,Disease,Medical condition,Enzyme,Hormone
Copious perspiration is known as this.,Diaphoresis,Diaphoresis,Deuterogamy,Detumescence,Diabolisation
Gerontology is the branch of medical science that deals with diseases and problems specific to these people.,Elderly,Adults,Elderly,Blind people,Children
"One of these terms means preserving the mutual relations of parts, especially as to size and form; maintaining relative proportion.",Homolographic,Homologisation,Homomorphic,Homomorphism,Homolographic
Hyperplasia is the abnormal increase in the number of these.,Cells,Species,Habitat,Teeth,Cells
The authority to teach religious doctrine is referred to as this.,Magisterium,Mastigophoran,Magistrature,Magistrateship,Magisterium
"The word vampire is a very controversial one, when it comes to its etymology. There are many theories about its origin and meaning. According to one of these theories, vampire comes from the Magyar words vam, meaning blood, and pir. What does pir mean in Magyar?",Monster,Blood,Animal,Human,Monster
"One of the most famous vampires is Dracula (some believe that he was the first vampire). In Romanian Dracul means either Dragon or Devil and therefore Dracula is translated as Son of the Dragon or Son of the Devil. Due to his favorite sadistic punishment, Vlad Dracula was nicknamed Tepes.  He preferred to kill those who opposed him in this manner.",Impalement,Hanging,Disembowelment,Impalement,Beheading
"Vlad Tepes was one of the major allies of the Ottoman Empire, therefore Romania was never put under Ottoman rule.",False,True,False,,
"Of course everybody knows about the Blood Vampires. They feed on the blood of their victims and prefer sucking it from the neck, the wrist or the groin. But there is another, less known, kind of vampires.  What do they feed on?",Aura,Vegetables,Flesh,Brains,Aura
"Vampires are common to the folklore of many countries. The Civatateo is an Aztec vampire, created when a noblewoman died at childbirth. In aboriginal mythology, vampires had suckers on their fingers. What are the Yakshis (sort of Indian vampires) like?",Beautiful women,Beautiful women,Ugly Men,Wounded Wolves,Innocent Children
"It is believed that you can stop a vampire, by throwing rice or marbles on the floor.",True,False,True,,
"One of the most popular ways of killing a vampire (apart from the trivial sharp wooden stick in the heart), is to expose the creature to sunlight. However, there is a disease, that has similar symptoms. People who suffer from it are very sensitive to sunlight and avoid going out during the day. What is this horrible disease?",Porphyria,Anemia,Scrapie,Influenza,Porphyria
"This woman was believed to be a vampire. She was obsessed with her beauty and youth, and slaughtered as many as six hundred innocent women in an attempt to maintain her vitality. Although her guilt has never been proven, she is still one of the most famous serial killers in Hungarian and Slovak history.",Elizabeth Bathory,Janos Benicka,Ilona Ujvary,Katarina Szentes,Elizabeth Bathory
Silver doesnt harm vampires.,False,False,True,,
"Peter Kurten was called a vampire, because he consumed the blood of some of his victims. He was accused of nine murders and seven attempted murders and was sentenced to death. He was guillotined on 2 June 1932. What was his nationality?",German,Briton,Romanian,Russian,German
"The great circle on the celestial sphere, midway between the celestial poles is called this.",Equinoctial,Equilibration,Equinity,Equilibria,Equinoctial
"If I am famous for my steadiness of mind under stress, then I am famous for this.",Equanimity,Equid,Equalization,Equanimity,Equalitarianism
"If a statement is ambiguous, it is said to be this.",Equivocal,Equestrian,Equipoised,Equivocal,Equilateral
One of the four pairs of words below contains two synonyms.,Equal - Equivalent,Equal - Equivalent,Equipollent - Equipped,Equipotential - Equilateral,Equipage - Equipoise
Do the words equivoke and equivoque mean the same?,Yes,No,Yes,,
Gilgamesh is a character from the Sumerian mythology.,True,True,False,,
Athena was the Greek equivalent of the goddess Minerva.,True,True,False,,
"Nike was a goddess, who personified triumph and victory (Greek mythology). Ironically, she was paralyzed and could not move her legs.",False,False,True,,
"Helicon is the name of an ancient lake, where the Muses were born.",False,True,False,,
Calliope was the muse for music.,False,True,False,,
Marduk was a Mesopotamian deity.,True,False,True,,
Svarog is the highest god of the pantheon (Slavic mythology) and the god of thunder and lightning.,False,True,False,,
The creature from Slavic mythology known as Zmey actually resembles a dragon.,True,False,True,,
Loki is the god of mischief of Norse mythology.,True,True,False,,
"One of these words has mid-17th century Latin origins and is a synonym of the word, wavy.",Undulate,Unhair,Unialgal,Unduly,Undulate
Which of these definitions does not describe a present day meaning of the word sesquipedalian?,Having a lot of feet,Characterized by the use of long words,Having a lot of feet,Having many syllables,Large in length
"The archaic word wittol, already out of use and found mostly in old books, stands for a person who is very wise.",False,True,False,,
Which of these words is used to describe something with a yellow color or tending toward a yellow color?,Xanthic,Xeric,Xenolith,Xanadu,Xanthic
The word âpromiscuousâ? is used in physical description to refer to someone with exclusive charm and sex appeal.,False,False,True,,
"We all know purple and its numerous variations, but can you name the odd one in this synonymic order dedicated to the shade of purple?",Indigo,Lavender,Indigo,Amethyst,Wine
"Having in mind the words meaning, does it  fit in the following analogy: Juvenile is to young as *geriatric* is to aged.",Yes,No,Yes,,
"The amarok, which is typical for the mythology of the Eskimos, is what kind of an animal?",wolf,whale,walrus,bear,wolf
"The banshee, a female spirit in Irish mythology, is known for doing what?",Wailing,Laughing,Stealing,Playing tricks,Wailing
"The hippocampus, a mythical monster with the head of a horse and body of a fish, pulled the chariot of which god?",Poseidon,Zeus,Poseidon,Mars,Neptune
Anubis was the jackal-headed judge of the dead from what mythology?,Egyptian,Egyptian,Aztec,Mesopotamian,Norse
The Kraken from seafaring lore was a monster often described as what?,Giant squid,Humpback whale,Giant jellyfish,Great White shark,Giant squid
A brownie is a legendary elf popular in the folklore of which two countries?,England  Scotland,Germany  Austria,England  Scotland,Ireland  Wales,Denmark  Holland
A cuero is a mythical giant octopus of which continent?,South America,South America,Africa,North America,Europe
"A dwarf is a little humanoid creature with a large head and a long beard, typical for what mythology?",Scandinavian,Cornish,Scottish,Celtic,Scandinavian
A ghul is an evil spirit encountered by travelers in what area of the world?,Arabian Dessert,Arabian Dessert,Scottish Highlands,Northern Africa,Australian Outback
The wodewose is a club-wielding ogre with green hair who suffers from what malady?,He was mute,He was mute,He was blind,He was lame,He was deaf
The gods Atum and Ra merged.  The dominant of the two was Ra.,True,True,False,,
Priests often wore a mask of this god during mummification ceremonies.,Anubis,Bastet,Hapy,Aten,Anubis
God Bes was depicted as this.,Dwarf with lion and human features,Dwarf with lion and human features,Giant with dog and human features,Dwarf with dog and human features,Giant with lion and human features
Osiris had an equivalent in Greek mythology.  Who was this counterpart of his?,Hades,Herakles,Zeus,Hades,Hermes
Tefnut had the body of a lioness.,False,False,True,,
The name of god Amen means this.,The Hidden One,The Wise One,The Stupid One,The Mighty One,The Hidden One
"At first, there was only this god. He was the dark waters of chaos.",Nun,Nun,Atum,Iris,Bes
The word tycoon means a wealthy businessperson.  What language does it come from?,Chinese,Greek,Latin,Russian,Chinese
"Apart from being the name of a well-known rock group, placebo also means an innocuous medicine, prescribed only for psychological effect over the patient or for experimentations. But what is its true meaning in Latin?",I shall please,Pleasure,Hypnotism,I shall please,Harmless
The original meaning of the word grotesque was very different from the one we know. What was it?,Fantastic,Foolish,Big,Illiterate,Fantastic
The Amazon estuary is truly magnificent. The word estuary comes from this language.,Latin,Latin,Chinese,Spanish,Portuguese
The word devil is derived from the Greek word diabolos. What does diabolos mean?,Accuser,Silly,Accuser,Offender,Insane
"After a divorce, the court might order one of the sides to pay an alimony. What are the origins of the word alimony?",Latin,Turkish,Greek,Latin,Japanese
The Greek word kome means hair of the head. Which one of these words derives from it?,Comet,Court,Coma,Comet,Comb
The name of the flower dandelion comes from this language.,French,Portuguese,Anglo-Saxon,French,Swedish
A good sense of humor is highly valued everywhere. The original meaning of the word humor in Latin (more accurately umor) is this.,Body fluid,State of mind,Body fluid,Good word usage,Good joke
"The word nice is very popular nowadays, but its original meaning in Latin is not as nice.",Ignorant,Disobedient,Clumsy,Ignorant,Hideous
The longest word in the English language is pneumonoultramicroscopicsilicovolcanoconiosis. It consists of 45 letters and stands for this.,Disease,Part of an organ,Surgical operation,Disease,Medical device
One of the following words is a synonym of the word cognoscente.,Connoisseur,Supervisor,Distributor,Philosopher,Connoisseur
The word razzmatazz means this.,Ambiguous language,Ambiguous language,Gizmo,Knick-knack,Amulet
A nap in the early afternoon is called by this word taken from Spanish.,Siesta,Enchilada,Taco,Arroyo,Siesta
Crwth is a fascinating word. It has no vowels. This is what it means.,Musical instrument,Tool,Musical instrument,Rulers title,Pot
"The she-goat Amalthea, which nursed baby Zeus, is represented by what constellation?",Capra,Hydra,Capricorn,Capra,Virgo
"This constellation was named after a Greek goddess. She was beautiful, but conceited. In order to punish her for that, Poseidon sent her figure to the skies upside down.",Cassiopeia,Perseus,Aquila,Andromeda,Cassiopeia
"There are many myths about this constellation. The earliest one, however, comes from a Sumerian legend about a female dragon, who ruled over the primordial ocean before the creation. But new gods rebelled against her and sent her to the skies.",Draco,Crux,Draco,Aquila,Cygnus
"Although it is a galaxy, the story about its creation is not less intriguing. Many legends associate its formation with milk spilled in one way or another. However, a Mesopotamian legend explains another thing. After the deluge the ark of Utnapishtim, the Sumerian Noah, was stuck on Mount Ararat. He then made a sacrifice to the gods and this galaxy was created out of the smoke of the fire.",The Milky Way,Aries,Draco,Ara,The Milky Way
"This constellation was named after a creature from the Greek mythology which is a combination between a human and a horse. Such creatures were of violent nature but there was one exception - Chiron, who was the tutor of Hercules.",Centaur,Eridanus,Auriga,Delphinus,Centaur
"This is a star group in Taurus. It was called after the seven daughters of the Titan Atlas and the Nymph Plieone - Alcyone, Maia, Electra, Merope, Taygeta, Celaeno, and Sterope.",Pleiades,Gemini,Aries,Pleiades,Crux
This constellation was named after a Greek hero who bragged to be the greatest hunter. Goddess Hera heard that and sent a scorpion after him to test his skills. The hero was stung to death by the scorpion. Zeus felt sorry and sent him to the sky.,Orion,Sagitta,Cancer,Sirius,Orion
"This constellation is often associated with Ganymede, who was a beautiful Phrygian youngster. Jupiter once saw him, fell in love with the lad and came to the earth as a bird, which took him to the skies. Since then he has served as the cup bearer of the gods.",Aquarius,Delphinus,Aquarius,Ara,Pisces
"This was the instrument that Orpheus played so well that his music enchanted even the wild beasts, the rocks, and the trees. After he lost his beloved one - Eurydice, Zeus placed Orpheuss musical instrument on the sky.",Lyre,Triangulum,Libra,Lyre,Sagitta
"This constellation represents the twin brothers Castor and Pollux. They were born by one mother, Leda, but had different fathers. Leda got pregnant simultaneously by Jupiter and the king Tyndarus of Sparta. When Castor died, Pollux felt so sorry that he begged Jupiter to unite them again, so Jupiter reunited the brothers in the sky.",Gemini,Gemini,Puppis,Pleiades,Pisces
What does the verb to dub mean?,To give a name,To make a major mistake,To study hard as in an all- nighter,To give a name,To hit very hard on the head or neck
"If you command a horse to gee, what do you expect him to do?",Turn right,Stop completely,Go back a few paces,Turn left,Turn right
"If you put a hex on someone, what have you done?",Put him or her under a spell,Curse that person to hell,Drown him or her as a witch.,Wish him or her good luck,Put him or her under a spell
Which of the following terms means to search for fun?,Gad,Dap,Vex,Gad,Gob
What does to vex mean?,To annoy,To annoy,To hurry,To spin very fast,To curse
What does to sup refer to?,Eat an evening meal,Eat soup very nosily,Dine in elegance,Eat an evening meal,Eat like an animal
What does the verb hew mean?,To cut,To cut,To fasten with glue or paste,To mend,To hollow out a log
Which of the following terms means to recede?,Ebb,Lob,Orb,Gee,Ebb
What does to hie mean?,To hurry,To hurry,To fear,To stop,To type by touch
What is the meaning of the verb to jam?,To interfer with a radio signal,To interfer with a radio signal,To spread with a jelly-like substance,To soak flax prior to spinning,To unclog a bunch of logs in a stream
Which of the following fictional or legendary hybrids is not half-human?,Baku,Merman,Asterius,Half-orc,Baku
Which of the following is a legendary creature with a lion body and eagle head and wings?,Griffin,Basilisk,Mandrake,Arachne,Griffin
"What is the name of the monstrous creature from Greek Mythology, that is the offspring of Typhon and Echidna?",Chimera,Chimera,Pegasus,Mermaid,Chiron
What kind of creature was the African mythological hybrid Jengu?,A water spirit,A water spirit,An elf,A lizard,A monstrous insect
This hybrid is an Egyptian sacred baboon with the head of a dog.,Cynocephalus,Sphinx,Felinity,Reprobus,Cynocephalus
What is the name of the legendary half-man and half-goat (or half-horse) creature often associated with male sexuality in Greek mythology?,Satyr,Praxiteles,Anubis,Pan,Satyr
"The sphinxes, the popular legendary creatures of the Ancient Egyptians, could be depicted with three different heads. Which head that was not typical for the sphinx?",Snake head,Snake head,Ram head,Bird head,Human head
"The legendary creature Peryton, that was said to come from the lost continent Atlantis, is a hybrid of what two animals?",Stag and bird,Stag and bird,Stag and snake,Horse and lizard,Bird and insect
Which of the following is an evil mythological hybrid of a woman and a bird?,Harpy,Ogress,Harpy,Trowe,Titan
The world sirena refers to this mythical or folklore hybrid of a woman and an animal?,Mermaid,Mermaid,Grendel,Vampire,Manticore
In which musical does Curly sing Surrey With the Fringe on Top to entice his girlfriend to accompany him to a party?,Oklahoma,Oklahoma,Will Rogers Follies,The Pajama Game,Sound of Music
"The hit song If I Were a Rich Man, which reflected the dreams of a poor milkman, came from which musical of the 60s?",Fiddler on the Roof,Fiddler on the Roof,42nd Street,Chicago,Cats
All That Jazz is the opening number of which 1975 Bob Fosse musical?,Chicago,42nd Street,Chicago,Fiddler on the Roof,Cats
The moving song I Am What I Am is sung at the end of Act I of which Jerry Herman hit show?,La Cage aux Folles,Hello Dolly,La Cage aux Folles,Damn Yankees,My Fair Lady
Which musical of the 50s featured the song Some Enchanted Evening?,South Pacific,Mame,Hello Dolly,South Pacific,George M.
Whatever Lola Wants is performed by the sultry Lola trying to tempt a faithful husband in which  Bob Fosse show?,Damn Yankees,Fosse,The Pajama Game,Chicago,Damn Yankees
In which show does Eliza sing The Rain in Spain?,My Fair Lady,My One and Only,Kismet,Kiss me Kate,My Fair Lady
Fill in the blank with the correct word:,My Fair Lady,,,,
Fill in the blank with the correct word:,its,...,its,...,its
The word catholic means the same whether capitalized or not.,False,False,True,,
"Stationery means fixed, not moveable.",False,True,False,,
Stationary is fancy writing paper.,False,False,True,,
What is the meaning of the adverb altogether?,Entirely,Entirely,Near by,Unclothed,In the same place
What does the collocation all together mean?,In the same place,In the same place,Completely,The same as altogether,All told
What does the word principal mean?,Main,Origin,Main,Characteristic,Law
Is counsel the correct word for a group called together for a purpose?,No,No,Yes,,
Counsel is giving of advice.,True,False,True,,
"These creatures ruled the world until they were overthrown by the Twelve Olympians, led by Zeus.",Titans,Cyclopes,Titans,Animals,Humans
"Cronus learned he was destined to be overcome by his own son as he had overthrown his own father, thats why he wanted to kill Zeus.",True,True,False,,
The Cyclopes gave Zeus fire.,False,True,False,,
Hermes is the highest ranking and most powerful god in Greek mythology.,False,True,False,,
What was Rembrandts last name?,Van Rijn,Rembrandt is his last name,Van Dyke,Bosch,Van Rijn
What was the first name of Van Goghs brother?,Theo,Theo,Pierre,Edward,Hans
For which opera did Gershwin become posthumously famous?,Porgy and Bess,Rhapsody in Blue,An American in Paris,The Days Gone By,Porgy and Bess
"The music for Swan Lake, one of the most critically-acclaimed ballets, was written by this composer.",Pyotr Ilyich Tchaikovsky,Aram Khachaturian,Pyotr Ilyich Tchaikovsky,Stern,Nikolai Rimsky-Korsakov
Violin virtuoso Itzach Perlman is a cousin of this entertainer.,Howie Mandel,Neil Sedaka,Howie Mandel,Bob Dylan,Isaac Stern
How many reeds does an oboe have?,2,3,2,1,0
"In what country was composer and pianist, Frederic Chopin born?",Poland,France,Poland,Switzerland,Belgium
Which of the following is a type of plaster used to paint on?,Gesso,Obsidium,Obstantium,Gesso,Gelato
"Which painter and founder of cubism would not divorce his first wife, Olga Khoklova, so she would not get half his wealth?",Picasso,Picasso,Klee,Cezanne,Remington
"This photographer, who taught at MIT for 10 years, developed the Zone System.",Minor White,Minor White,Alfred Stieglitz,Paul Curtis,Barbara Morgan
Which of the following group of animals is not referred to as a herd?,Rhinoceroses,Rhinoceroses,Boars,Chinchillas,Walruses
Which prefix means under?,Sub-,Supra-,Sub-,Un-,Super-
Which suffix means fear?,-phobia,-itis,-phobia,-philia,-mony
Which prefix means within?,intra-,intra-,inter-,pseudo-,hemi-
When prefix means high?,Alti-,Apo-,Peri-,Alti-,Pleo-
All but one of the following suffixes changes the word from an adjective or a verb into a noun.  Which is the odd one?,-ous,-ous,-ion,-ity,-ness
Which suffix means foot?,-pus,-morph,-flex,-pus,-fer
Which suffix means one who?,-er,-able,-ship,-ous,-er
Which prefix means across a distance?,TELE-,TELE-,PALEO-,PHILO-,PROTO-
Which of the following prefixes does not mean not?,Pan,A-,In-,Non-,Pan
Which prefix means together?,CO-,CO-,PROTO-,SOLI-,HETERO-
Freya was the goddess of this.,Love and beauty,Poetry,The flowers,Love and beauty,Old age and madness
There were two major clans of Norse gods - Vanir and Æsir.,True,False,True,,
Odins favorite pets were these creatures.,Ravens,Ravens,Bats,Hawks,Snakes
What did god Tyr sacrifice in order to bind the evil Fenris wolf?,His hand,His hand,His eye,His head,His leg
Which of the following gods was famous for his talent to quickly transform his appearance?,Loki,Fenrir,Loki,Asgard,Hel
God Ori was a giant.,False,False,True,,
"Goddess Skadi was not permitted to look at the gods faces, while choosing her husband among them.",True,True,False,,
Norse mythology associates the aurora with this beautiful goddess.,Freya,Frigg,Freya,Elli,Eir
"He was the first man, according to Norse mythology.",Ask,Annar,Ask,Arvak,Aud
"In what movie does a character say,  Yo, Adrian.?",Rocky,The Godfather,Rocky,"New York, New York",On the Waterfront
Yo-Yo Ma is considered by most to be the best musician in the world to play this instrument. Yo-Yo Mas nickname for his instrument is Petunia. What type of instrument is Petunia?,Cello,Classical Guitar,Flute,Violin,Cello
"If a person is downright, then he is this.",Candid,Candid,Cordial,Gentle,Compassionate
A playwright is someone who writes for the theatre. One of the following famous Greeks was not a playwright.,Tyrtaeus,Aeschylus,Sophocles,Aristophanes,Tyrtaeus
One of these is not a spright.,A dwarf.,A dwarf.,A specter or ghost.,An elflike person.,A soul.
"If he denied the charges outright, then his denial cannot be described as this.",Kind,Open,Complete,Immediate,Kind
In the UK one of these parties is not considered right-winged.,Scottish National Party,United Kingdom Independence Party,Scottish National Party,Conservative Party,Democratic Unionist Party
Dexter from Dexters Lab was right-handed.,False,True,False,,
Which of these languages is not an official national language in a South American country?,German,English,Dutch,German,Guarani
What language has the most native speakers in the world?,Mandarin,English,Spanish,Arabic,Mandarin
"What movie features an actor speaking one of the Khoisan languages of southwestern Africa, which have a range of click sounds (sounds which are not found outside this region)?",The Gods Must Be Crazy,A Dry White Season,The Gods Must Be Crazy,Cry Freedom,Hotel Rwanda
"The largest language family (a group of historically related languages) is the Indo-European family, which includes well-known European languages such as English, French and Russian. Which of the following languages is NOT a member of this family?",Hebrew,Hindi,Hebrew,Armenian,Kurdish
What European language is not related to any other language in the world?,Basque,English,Greek,Hungarian,Basque
